quarter,pdf_page,printed_page,section,lang,char,topic,serial,reg,copies,printer_verbatim,printer,pcity,author,title,title_native,gloss,pp_verbatim,publisher,pubcity,date,price,edition,format,method,educ,copyright,notes,marks,norm_lang,periodical,norm_printer,norm_pcity,norm_publisher,norm_pubcity,pp_sum,flags_json
1910Q3,138,42,URDU—POETRY.—continued.,Urdu,,Poetry,56,1057,1300,"Newal Kishore, Press, Lahore.",Newal Kishore Press,Lahore,"Nawab Mirza Khan, Dagh",Mahtab-i-Dagh,True,Love verses.,315,"Lala Sri Ram, M. A., Munsif",Delhi,1910-06,"Rs. 3-8, superior; Rs. 3, ordinary",1st,8°,litho.,,"Lala Siri Ram, Delhi; No. 13(?), dated the (?) September, 1910.","Posthumous divan of Dagh Dehlvi (d. 1905), published by Lala Sri Ram (compiler of Khumkhana-i-Javed) — Hindu munsif as custodian of the Urdu canon.",X; pencil '68' right margin,Urdu,,Newal Kishore Press,Lahore,"Lala Sri Ram, M. A., Munsif",Delhi,315,"[{""field"": ""copyright"", ""issue"": ""register number and day partially legible""}]"
1910Q3,139,43,URDU—POLITICS.,Urdu,,Politics,2,1041,100,"Rafah-i-'Am Steam Press, Lahore.",Rafah-i-'Am Steam Press,Lahore,"Ghulam Mustafa, Hafiz",Hindustan aur Angrezi Hakumat,True,"A pamphlet in which the writer condemns the anarchical outrages perpetrated in India and compares the British rule with the governments of foreign countries, old and new, and trying to prove the superiority of the former.",52,"The author who is Subedar, Regiment No. 92 Punjabis",,1910-07,Free,1st,16°,litho.,,,Loyalist tract against 'anarchical outrages' (revolutionary violence) by a serving Indian Army subedar; 100 free copies. Rare POLITICS section — direct window on surveillance-era political print.,X; pencil '69' right margin,Urdu,,Rafah-i-Am Steam Press,Lahore,"The author who is Subedar, Regiment No. 92 Punjabis",,52,[]
1910Q3,139,43,URDU—POLITICS.,Urdu,,Politics,3,882,500,"Hindustan Steam Press, Lahore.",Hindustan Steam Press,Lahore,Haji Rahm Shahid,Tarifha-i-Government-i-Aliya,True,A pamphlet describing the blessings of British rule in India.,56,Author,Lahore,1910-06,2 annas,1st,8°,litho.,,,'Praises of the Exalted Government' — loyalist panegyric.,X; pencil '70' right margin,Urdu,,Hindustan Steam Press,Lahore,Author,Lahore,56,[]
1910Q3,139,43,URDU—POLITICS.,Urdu,,Politics,4,799,350,"Mujaddidi Press, Amritsar.",Mujaddidi Press,Amritsar,,Ulil Amr,True,"A pamphlet in which the writer tries to show that loyalty to Government, whether Muhammadan or not, is enjoined by the Quran, with a note on the blessings of the British rule.",34,"Compiled and published by Qazi Ghulam Muhi-ud-din, Akhgar, Editor ""Al-Aziz""","Batála, Gurdáspur district",1910-06-15,4 annas,1st,16°,litho.,,,"Quranic argument (ulu'l-amr) for loyalty to non-Muslim government, by a newspaper editor — theological loyalism after 1909 reforms. All three POLITICS entries this quarter are pro-government.",X; pencil '71' right margin,Urdu,,Mujaddidi Press,Amritsar,"Compiled and published by Qazi Ghulam Muhi-ud-din, Akhgar, Editor ""Al-Aziz""","Batala, Gurdaspur district",34,[]
1910Q3,139,43,URDU—RELIGION.,Urdu,,Religion,53,1045,500,"Rafah-i-'Am Steam Press, Lahore.",Rafah-i-'Am Steam Press,Lahore,"Abdul Basit, Hafiz, alias Sayad Muhammad Alam",Risala Musamma ba Qaul-ul-Fasl,True,"A controversial pamphlet in which the writer, who is a Shia, tries to prove that a certain verse of the Quran which is held by the Sunnis to be in praise of the first Caliph does not establish his [first Caliph's] excellence over others.",8,Author,Maghowál,1910-07,Free,1st,8°,litho.,,,URDU—RELIGION serials continue from Q2. Dual date: 1328 Hijri / July 1910. Shia–Sunni polemic.,X; pencil '72' right margin,Urdu,,Rafah-i-Am Steam Press,Lahore,Author,Maghowal,8,"[{""field"": ""serial"", ""issue"": ""margin serial partially cut; read as 53 (54, 55 follow; page 44 resumes at 56)""}]"
1910Q3,139,43,URDU—RELIGION.,Urdu,,Religion,54,939,2000,"Newal Kishore, Press, Lahore.",Newal Kishore Press,Lahore,"Abdul Haji, Maulana",Silah-i-Rihm,True,"A booklet in which the writer discusses from the Muhammadan point of view, quoting the Quran and traditions, the importance and sanctity of respecting relations on the mother's side.",32,"The Vakil Trading Company, Limited",Amritsar,1910-06,2 annas,2nd,16°,litho.,,,,X; pencil '73' right margin,Urdu,,Newal Kishore Press,Lahore,"The Vakil Trading Company, Limited",Amritsar,32,[]
1910Q3,139,43,URDU—RELIGION.,Urdu,,Religion,55,941,2000,Ditto,Newal Kishore Press,Lahore,"Ahmad Khan, Sir, Sayad",Al-Khutubat-ul-Ahmadiya,True,"A collection of lectures by Sir Sayad Ahmad Khan on the early Arabs and on Islam, refuting objections against the faith.",752,"The Vakil Trading Company, Limited",Amritsar,1910-06,Rs. 2 (bound); Re. 1-8 (paper cover),1st,16°,litho.,,,"Sir Syed Ahmad Khan's Khutbat-i-Ahmadiya (reply to Muir's Life of Mahomet), 752 pp. — Vakil Trading Co. canon-reprint program continues.",X; pencil '74' right margin,Urdu,,Newal Kishore Press,Lahore,"The Vakil Trading Company, Limited",Amritsar,752,[]
1910Q3,139,43,URDU—POETRY.—concluded.,Urdu,,Poetry,57,973,1000,"Shahi Press, Ludhiána.",Shahi Press,Ludhiána,,"Silsila-i-Najat, Hissa-i-Duwum",True,Verses in praise of Muhammad.,8,"Shaikh Muhammad Bakhsh Fazl-i-Husain, Book-sellers",Ludhiána,1910-07-08,3 pies,1st,8°,litho.,,,,,Urdu,,Shahi Press,Ludhiana,"Shaikh Muhammad Bakhsh Fazl-i-Husain, Book-sellers",Ludhiana,8,[]
1910Q3,139,43,URDU—POETRY.—concluded.,Urdu,,Poetry,58,916,300,"Newal Kishore Press, Lahore.",Newal Kishore Press,Lahore,"Waiz, R. M.",Masihi Git ki Kitab,True,A booklet containing hymns.,32,The Christian Knowledge Society,Lahore,1910-05,Free,1st,8°,litho.,,,Christian hymnal in Urdu. End of URDU—POETRY (serials 37–58 this quarter).,,Urdu,,Newal Kishore Press,Lahore,The Christian Knowledge Society,Lahore,32,[]
1910Q3,140,44,URDU—RELIGION.—continued.,Urdu,,Religion,56,931,1000,"Newal Kishore Press, Lahore.",Newal Kishore Press,Lahore,"Ahmad Khan, Sir Sayad","Conscience, Zamir",True,A lecture on Conscience from the Muhammadan point of view.,4 and 16,"The Vakil Trading Company, Limited",Amritsar,1910-06,1 anna,1st,16°,litho.,,,Sir Syed reprint series continues (Vakil Trading Co.).,,Urdu,,Newal Kishore Press,Lahore,"The Vakil Trading Company, Limited",Amritsar,20,[]
1910Q3,140,44,URDU—RELIGION.—continued.,Urdu,,Religion,57,934,2000,Ditto,Newal Kishore Press,Lahore,"Ahmad Khan, Sir Sayad, and Charagh Ali, Maulvi",Haqiqat-us-Sihr,True,Lectures on the Islamic conception of necromancy.,43,"The Vakil Trading Company, Limited",Amritsar,1910-06,2 annas,1st,16°,litho.,,,Joint reprint: Sir Syed (dash-continuation) and Charagh Ali on magic/necromancy — rationalist theology.,,Urdu,,Newal Kishore Press,Lahore,"The Vakil Trading Company, Limited",Amritsar,43,[]
1910Q3,140,44,URDU—RELIGION.—continued.,Urdu,,Religion,58,936,2000,Ditto,Newal Kishore Press,Lahore,"Ahmad Khan, Sir Sayad",Mahdi-i-Akhir-uz-Zaman,True,"A booklet in which the writer tries to prove that the belief of the Muhammadans that the Mahdi, the twelfth Imam, will re-appear towards the end of this world, is based on unreliable traditions.",37,"The Vakil Trading Company, Limited",Amritsar,1910-06,2 annas,1st,16°,litho.,,,Dash-continuation follows the joint entry at serial 57; attributed to Sir Sayad Ahmad Khan (his known anti-Mahdist essay).,X; pencil '75' right margin,Urdu,,Newal Kishore Press,Lahore,"The Vakil Trading Company, Limited",Amritsar,37,"[{""field"": ""author"", ""issue"": ""dash-continuation after joint authorship — could include Charagh Ali""}]"
1910Q3,140,44,URDU—RELIGION.—continued.,Urdu,,Religion,59,889,1009,"Hindustan Steam Press, Lahore.",Hindustan Steam Press,Lahore,,Aina-i-Qadiyani,True,A pamphlet directed against Mirza Ghulam Ahmad of Qádián.,8,"M. Karm-ud-din, Book-seller",Lahore,1910-06,3 pies,1st,8°,litho.,,,Anti-Ahmadi polemic — printed alongside Ahmadi works this same quarter (p41 s39).,X; pencil '76' right margin,Urdu,,Hindustan Steam Press,Lahore,"M. Karm-ud-din, Book-seller",Lahore,8,"[{""field"": ""copies"", ""issue"": ""printed '1,009' — possibly misprint for 1,000; transcribed as printed""}]"
1910Q3,140,44,URDU—RELIGION.—continued.,Urdu,,Religion,60,938,2000,"Newal Kishore Press, Lahore.",Newal Kishore Press,Lahore,"Charagh Ali, Maulvi",Hasrat-i-Isa aur Salib,True,"A booklet in which the writer, who is a follower of Mirza Ghulam Ahmad of Qádián, tries to prove, with quotations from the Quran and the traditions, that Christ was not crucified but died a natural death and that he does not live, and will return to this world as believed by the Muhammadans and Christians.",17,"The Vakil Trading Company, Limited",Amritsar,1910-06,1 anna,1st,16°,litho.,,,Ahmadi christology (natural death of Jesus). Catalogue's gloss reads 'and will return' where 'will not return' is evidently intended — transcribed as printed.,X; pencil '77' right margin,Urdu,,Newal Kishore Press,Lahore,"The Vakil Trading Company, Limited",Amritsar,17,[]
1910Q3,140,44,URDU—RELIGION.—continued.,Urdu,,Religion,61,937,2000,Ditto,Newal Kishore Press,Lahore,"Charagh Ali, Maulvi",Ihsán-i-'Am,True,"A small pamphlet in which the writer tries to explain, with quotations from the Quran, that Islam enjoins kindness to all mankind.",16,"The Vakil Trading Company, Limited",Amritsar,1910-06,1 anna,1st,16°,litho.,,,Author dash-continuation of serial 60.,X; pencil '78' right margin,Urdu,,Newal Kishore Press,Lahore,"The Vakil Trading Company, Limited",Amritsar,16,[]
1910Q3,140,44,URDU—RELIGION.—continued.,Urdu,,Religion,62,731,2000,"Sanatan Dharam Press, Amritsar.",Sanatan Dharam Press,Amritsar,"Gokal Das, Mahant",Swami Daya Nand ji ki das fash ghalatian,True,"A tract in which the writer points out ten gross mistakes committed by Swami Daya Nand, the founder of the Arya Samaj, in making quotations from the Vedas, etc.",8,Author,Amritsar,1910-05-01,Free,1st,8°,litho.,,,Sanatanist anti-Arya Samaj polemic; same Mahant Gokal Das as p41 s40.,X; pencil '79' right margin,Urdu,,Sanatan Dharam Press,Amritsar,Author,Amritsar,8,[]
1910Q3,140,44,URDU—RELIGION.—continued.,Urdu,,Religion,63,923,3000,"Newal Kishore Press, Lahore.",Newal Kishore Press,Lahore,,Kalid-ut-Tauhid,True,"A booklet on sufi-ism, containing instructions for disciples, trnnslated by Maulvi Abdus Sattar of Tonk from the original by Hazrat Bahu, a well-kuown Muhammadan saint of the Punjab.",32,"Malak Fazl-ud-din Chanan Din and Taj-ud-din, Book-sellers",Lahore,1910-05,2 annas,2nd,8°,litho.,,,"Sultan Bahu's Kalid-ut-Tauhid in Urdu translation. [Previous edition noticed in entry No. 232 at page 39 of the Catalogue for the quarter ending the 31st March, 1906.]",X; pencil '80' right margin,Urdu,,Newal Kishore Press,Lahore,"Malak Fazl-ud-din Chanan Din and Taj-ud-din, Book-sellers",Lahore,32,[]
1910Q3,141,45,URDU—RELIGION.—continued.,Urdu,,Religion,64,1075,500,"Rajput Priuting Works, Lahore.",Rajput Printing Works,Lahore,Labhdi Bijayaji,Dayanand Kutark Nirnai,True,"This pamphlet tries to refute the objections against Jainism contained in the Sattyarth Prakash of Swami Dayanand, the founder of the Arya Samaj.",112,Labhu Ram,"Zira, district Ferozepore",1910-08,6 annas,1st,8°,litho.,,,Jain rebuttal of Dayanand's Satyarth Prakash — Jain voice in the Punjab polemical arena.,X; pencil '81' right margin,Urdu,,Rajput Printing Works,Lahore,Labhu Ram,"Zira, district Ferozepore",112,[]
1910Q3,141,45,URDU—RELIGION.—continued.,Urdu,,Religion,65,1122,500,"Imperial Book Depôt, Delhi.",Imperial Book Depôt Press,Delhi,,Maut ke bad kya hota hai,True,"A lecture on what takes place after death, adapted from the theosophical works of Leadbeater, by Rai Bishambar Nath of Delhi.",48,The compiler,Delhi,1910-08-01,3 annas,1st,8°,litho.,,"Rai Bishambhar Nath, Delhi; No. 153, dated the 22nd September, 1910.",Leadbeater's Theosophy in Urdu — same Theosophist compiler as the Blavatsky biography (p26 s32).,,Urdu,,Imperial Book Depot Press,Delhi,The compiler,Delhi,48,[]
1910Q3,141,45,URDU—RELIGION.—continued.,Urdu,,Religion,66,947,500,"Newal Kishore Press, Lahore.",Newal Kishore Press,Lahore,,Miftah-ul-A'mal,True,"An adapted translation by the Revd. Dr. H. U. Wightbrecht, Ph. D., D. D. of Canon Morris' Key to the Acts, with Appendicies.",158,The Christian Knowledge Society,Lahore,1910-06,6 annas,1st,8°,litho.,,,Missionary biblical commentary in Urdu.,,Urdu,,Newal Kishore Press,Lahore,The Christian Knowledge Society,Lahore,158,[]
1910Q3,141,45,URDU—RELIGION.—continued.,Urdu,,Religion,67,723,2000,"Qasimi Press, Hyderabad, Deccan.",Qasimi Press,"Hyderabad, Deccan","Muhammad Abdul Aziz, Maulvi",Aziz-ul-Akhirat,True,"A last will which the author on his death bed addresses to his two sons, enjoining upon them strict observance of the Muhammadan religious precepts, with other admonitions for their guidance.",162,Author,Deccan,1910,Re. 1,2nd,8°,litho.,,"M. Abdur Rahman and M. Ahmad Abdullah, Deccan, No. 97, dated the 7th July, 1910.",Dual date: 1326 Hijri. Hyderabad-printed book registered in Punjab; copyright held by the sons addressed in the will.,X,Urdu,,Qasimi Press,"Hyderabad, Deccan",Author,Deccan,162,[]
1910Q3,141,45,URDU—RELIGION.—continued.,Urdu,,Religion,68,1046,500,"Rafah-i-'Am Steam Press, Lahore.",Rafah-i-'Am Steam Press,Lahore,"Muhammad Haidarullah Khan, Maulvi",Al-Atban ala Imámat-il-Umyan,True,A pamphlet in which the writer tries to prove that to perform prayers behind a blind man is forbidden by the Muhammadan law.,40,Author,Jalálpur Jattán,1910-07,8 annas,1st,8°,litho.,,,Fiqh controversy on blind imams.,X; pencil '83' right margin,Urdu,,Rafah-i-Am Steam Press,Lahore,Author,Jalalpur Jattan,40,[]
1910Q3,141,45,URDU—RELIGION.—continued.,Urdu,,Religion,69,1039,1000,Ditto,Rafah-i-'Am Steam Press,Lahore,"Muhammad Salih, Maulvi","Silsila-i-Islam, Hissa-i-Duwum. Najaston ka bayan",True,"Book No. 2 of a series entitled the Silsila-i-Islam, on impurities, their effect and how to remove them.",208,"Munshi Din Muhammad, Book-seller",Lahore,1910-07,4 annas,1st,16°,litho.,,,Dual date: 1328 Hijri / July 1910.,X; pencil '84' right margin,Urdu,,Rafah-i-Am Steam Press,Lahore,"Munshi Din Muhammad, Book-seller",Lahore,208,[]
1910Q3,141,45,URDU—RELIGION.—continued.,Urdu,,Religion,70,1040,1000,Ditto,Rafah-i-'Am Steam Press,Lahore,"Muhammad Salih, Maulvi",Hissa-i-Siwum. Ghusl ka bayan,True,"No. 3, on washing and ablution.",192,"Munshi Din Muhammad, Book-seller",Lahore,1910-07,4 annas,1st,16°,litho.,,,Author dash-continuation of serial 69; part 3 of the Silsila-i-Islam series. Dual date: 1328 Hijri.,,Urdu,,Rafah-i-Am Steam Press,Lahore,"Munshi Din Muhammad, Book-seller",Lahore,192,[]
1910Q3,141,45,URDU—RELIGION.—continued.,Urdu,,Religion,71,802,300,"Mujaddidi Press, Amritsar.",Mujaddidi Press,Amritsar,,Nai Ginti,True,"Tract No. 33-3 in which the numerals from 1 to 20 are taught and along with them Muhammadan precepts, such as God is one, the main principles of Islam are two, viz., belief in God and the profession of that belief, etc.",32,The Anjuman-i-Rafiq-ul-Islam,Amritsar,1910-06-20,Free,1st,32°,litho.,,,Numeracy primer doubling as catechism — religious pedagogy through arithmetic.,,Urdu,,Mujaddidi Press,Amritsar,The Anjuman-i-Rafiq-ul-Islam,Amritsar,32,[]
1910Q3,142,46,URDU—RELIGION.—concluded.,Urdu,,Religion,72,1115,400,"Badr Press, Qádián.",Badr Press,Qádián,Qazi Akmal,Kitab-us-Siyim,True,"A booklet in which injunctions about fasting are interpreted for the guidance of Ahmadis, from the point of view of a follower of Mirza Ghulam Ahmad of Qádián.",12,Badr Book Agency,Qádián,1910-09-01,1 anna,1st,8°,litho.,,,Dual date: 1328 Hijri / 1st September 1910. Ahmadi fiqh from Qadian's own press.,X; pencil '85' right margin,Urdu,,Badr Press,Qadian,Badr Book Agency,Qadian,12,[]
1910Q3,142,46,URDU—RELIGION.—concluded.,Urdu,,Religion,73,1058,2000,"Newal Kishore Press, Lahore.",Newal Kishore Press,Lahore,Satya Dhari,Mi'yar-i-Sadaqat,True,"For subject see entry No. 39 at page 41 of the catalogue for the quarter ending the 30th September, 1910.",552,,,1910-08,Re. 1,2nd,8°,litho.,,"S. Sat Dhari, Lahore; No. (?), dated the (?) September, 1910.","Cross-reference within this same quarter's catalogue (entry 39, page 41). 552 pages.",X; pencil '86' right margin,Urdu,,Newal Kishore Press,Lahore,,,552,"[{""field"": ""copyright"", ""issue"": ""register number and day partially legible""}, {""field"": ""gloss"", ""issue"": ""self-referential cross-reference — target entry No. 39 p41 is in this quarter's Urdu—Poetry (Durar-i-Samin?); verify at adjudication""}]"
1910Q3,142,46,URDU—RELIGION.—concluded.,Urdu,,Religion,74,1071,1000,"Arya Steam Press, Lahore.",Arya Steam Press,Lahore,"Shahzada Ram, Lala",Mukti ka Satya Gyan,True,"A pamphlet dealing with such subjects as God, the soul, pure-living, &c., in the light of the Arya Samaj tenets.",128,Author,Lahore,1910-07,"3 annas, 6 pies",2nd,16°,litho.,,,,X; pencil '87' right margin,Urdu,,Arya Steam Press,Lahore,Author,Lahore,128,[]
1910Q3,142,46,URDU—RELIGION.—concluded.,Urdu,,Religion,75,1116,2400,"Badr Press, Qádián",Badr Press,Qádián,,Sharait-i-Baia't,True,"For subject see entry No. 48 at page 36 of the catalogue for the quarter ending the 30th June, 1910.",8,Badr Book Agency,Qádián,1910-09-01,3 pies,2nd,16°,litho.,,,"Cross-reference: 1910Q2 entry 48, page 36 (our Q2 extraction). Conditions of bai'at (initiation) into the Ahmadiyya.",,Urdu,,Badr Press,Qadian,Badr Book Agency,Qadian,8,[]
1910Q3,142,46,URDU—RELIGION.—concluded.,Urdu,,Religion,76,946,1000,"Newal Kishore Press, Lahore.",Newal Kishore Press,Lahore,Sharf,Sitaish wa Tárif ki Kitab,True,"A tract in which the writer deals with the sacredness of the Zabur or the Book of Psalms, which he thinks the oldest inspired book.",28,The Punjab Religious Book Society,,1910-06,Free,1st,16°,litho.,,,,,Urdu,,Newal Kishore Press,Lahore,The Punjab Religious Book Society,,28,[]
1910Q3,142,46,URDU—RELIGION.—concluded.,Urdu,,Religion,77,852,1000,"Arya Steam Press, Lahore.",Arya Steam Press,Lahore,"Shiv Brat Lal, M.A., Babu",Upanishad,True,"An Urdu translation of the ten principal Upanishads, with short explanatory notes here and there.",576,"Bharat Literature Company, Limited",Lahore,1910-06,12 annas,1st,16°,litho.,,,"Ten principal Upanishads in Urdu, 576 pp. — third Shiv Brat Lal title this quarter (with p27 s39, p37 s122).",X; pencil '88' right margin; illegible cursive pencil note lower left margin (reads like 'with … not sandpath I'),Urdu,,Arya Steam Press,Lahore,"Bharat Literature Company, Limited",Lahore,576,[]
1910Q3,142,46,URDU—RELIGION.—concluded.,Urdu,,Religion,78,948,100,"Newal Kishore Press, Lahore.",Newal Kishore Press,Lahore,,"Zabur ki Kitab ke Chand Mazamir ka Tarmim Shuda Tarjama, Hissa-i-Duwum",True,"A translation in Urdu of certain Psalms of David, Part II by Rev. H. U. Wightbrecht, Ph. D., D. D.",91,The Christian Knowledge Society,Lahore,1910-06,2 annas,1st,8°,litho.,,,Same missionary translator as p45 s66; 100 copies only.,pencil '89' right margin,Urdu,,Newal Kishore Press,Lahore,The Christian Knowledge Society,Lahore,91,[]
1910Q3,142,46,URDU—RELIGION.—concluded.,Urdu,,Religion,79,1052,2000,"Hamidiya Steam Press, Lahore.",Hamidiya Steam Press,Lahore,"Muhammad Muazzam, Maulvi",Islam ki Pahli Kitab,True,The first book of Islam containing preliminary religious precepts for Muhammadan boys.,32,Author,Lahore,1910-07-19,"1 anna, 3 pies",1st,16°,litho.,Y,,Entry preceded by '(Designed for educational purposes.)'.,,Urdu,,Hamidiya Steam Press,Lahore,Author,Lahore,32,[]
1910Q3,143,47,BILINGUAL (ARABIC AND PUNJABI IN PERSIAN CHARACTER)—POETRY.,Bilingual (Arabic Punjabi),Persian,Poetry,1,794,500,"Ráwalpindi Press, Ráwalpindi city.",Ráwalpindi Press,Ráwalpindi city,"Barkat Ram, Pandit",Anisul-Ghuraba,True,A booklet in which symptoms of certain diseases have been mentioned. It is said to be the translation of Hippocrates' book Qabriya in Greek which was rendered into Arabic by Hussain ibn Ishaq during the reign of Caliph Al-Mamun-ur-Rashid. The author has translated from the Arabic version.,40,"The author, a resident of Nunar, tahsil Pasrúr, Siálkot district","Nunar, tahsil Pasrúr, Siálkot district",1910-04-10,6 annas,1st,8°,litho.,,"P. Barkat Ram, Siálkot district; No. 113, dated the 14th July 1910.",Greek→Arabic→Punjabi transmission chain: Hippocrates via Hunayn ibn Ishaq (Ma'mun-era Baghdad) translated by a village pandit — millennium-long knowledge circulation caught in the register.,X at section header; pencil '91' right margin,Bilingual (Arabic and Punjabi),,Rawalpindi Press,Rawalpindi,"The author, a resident of Nunar, tahsil Pasrur, Sialkot district","Nunar, tahsil Pasrur, Sialkot district",40,[]
1910Q3,143,47,URDU—TRAVELS.,Urdu,,Travels,3,917,1000,"Rafah-i-'Am Steam Press, Lahore.",Rafah-i-'Am Steam Press,Lahore,"Abdur Rahman, Hafiz",Siyahat-i-Hind,True,An account of the author's travels for seven years to the important cities throughout India.,448,Author,Lahore,1910-05,"Rs. 2, 8 annas",1st,8°,litho.,,,"Seven-year India travelogue, 448 pp. — vernacular travel writing mapping the subcontinent.",X; pencil '90' right margin,Urdu,,Rafah-i-Am Steam Press,Lahore,Author,Lahore,448,[]
1910Q3,143,47,BILINGUAL (ARABIC AND SINDHI) RELIGION.,Bilingual (Arabic Sindhi),,Religion,4,1061,1000,"Arya Steam Press, Lahore.",Arya Steam Press,Lahore,,Kitab-us-Salaut Sindhi,True,"A booklet describing injunctions to be observed in performing various kinds of prayers with khutbas or sermons, read prior to performing Juma (Friday) congregational prayer.",66,Lala Pokar Das,Shikarpur,1910-07,4 annas,1st,8°,litho.,,,Hindu book-seller (Pokar Das of Shikarpur) publishing Muslim prayer manual — his sixth entry this quarter.,,Bilingual (Arabic and Sindhi),,Arya Steam Press,Lahore,Lala Pokar Das,Shikarpur,66,[]
1910Q3,143,47,BILINGUAL (ARABIC AND PERSIAN)—RELIGION.,Bilingual (Arabic Persian),,Religion,8,722,2000,Dar-ut-Taba-i-Sarkar-i-Ali Hydarabad (Deccan).,Dar-ut-Taba-i-Sarkar-i-Ali,Hydarabad (Deccan),"Abdul Aziz, Muhammad, Maulvi",Aziz-ul-Akhlaq,True,"A book on Muhammadan precepts, with quotations from the Quran and the traditions.",100,Author,"Hyderabad, Deccan",,Re. 1,2nd,4°,litho.,,"M. Abdur Rahman and M. Ahmad Abdullah, Deccan; No. 96, dated the 7th July, 1910.","Date printed only as 7th Rajab, Hijri 1319 (≈ Oct 1901 — likely first-edition date). Same Deccan author/heirs as p45 s67 (copyright Nos. 96–97 consecutive). Hyderabad state press.",,Bilingual (Arabic and Persian),,Dar-ut-Taba-i-Sarkar-i-Ali,"Hyderabad, Deccan",Author,"Hyderabad, Deccan",100,"[{""field"": ""date"", ""issue"": ""only Hijri 1319 printed; no Christian date given""}]"
1910Q3,143,47,URDU—SCIENCE—MATHEMATICAL.,Urdu,,Science (Mathematical),11,1124,500,Imperial Book Depôt Press Delhi.,Imperial Book Depôt Press,Delhi,,Abad Sayyarah wa Chotidar Tara,True,"A small book giving an account of the earth, the solar system and other phenomena, such as meteors, the milky-way, comets, &c., with their formation, size, distance from the earth and the sun, revolutions and the creatures inhabiting them, compiled by Lala Tara Chand, Pleader, Bikáner State.",48,The Compiler,Baháwalpur,1910-08-01,6 annas,1st,16°,litho.,,,"Popular astronomy (Halley's comet year) including 'creatures inhabiting' the planets; compiler a pleader in Bikaner, publishing from Bahawalpur.",,Urdu,,Imperial Book Depot Press,Delhi,The Compiler,Bahawalpur,48,[]
1910Q3,143,47,URDU—SCIENCE—MATHEMATICAL.,Urdu,,Science (Mathematical),12,776,1000,"Mufid-i-'Am Press, Lahore.",Mufid-i-'Am Press,Lahore,"Jiwan Singh, Munshi",Gulshan Pahara,True,Mathematical tables for use in the 2nd and 3rd Lower Primary Classes.,36,"The Author who is teacher in the Aided School, Pul Kanjri, Amritsar district","Pul Kanjri, Amritsar district",1910-04-23,"1 anna, 3 pies",2nd,8°,litho.,Y,,Entry preceded by '(Designed for educational purposes.)'.,,Urdu,,Mufid-i-Am Press,Lahore,"The Author who is teacher in the Aided School, Pul Kanjri, Amritsar district","Pul Kanjri, Amritsar district",36,[]
1910Q3,143,47,URDU—SCIENCE—MATHEMATICAL.,Urdu,,Science (Mathematical),13,1117,350,"Ráwalpindi Press, Ráwalpindi City",Ráwalpindi Press,Ráwalpindi City,"Rang Bihari Lal, Lala",Talim-ul-Hisab,True,An arithmetic for the use of teachers of Primary Schools and pupils of Normal Schools.,238,"The Author who is Head Master, Normal School, Ráwalpindi",Ráwalpindi,1910-08-08,Re. 1,1st,8°,litho.,,"Lala Rang Bihari Lal, Ráwalpindi; No. 148, dated the 17th September, 1910.",Same Rang Behari Lal who translated Caleb's Eyesight in Schools (p32 s21).,,Urdu,,Rawalpindi Press,Rawalpindi,"The Author who is Head Master, Normal School, Rawalpindi",Rawalpindi,238,[]
1910Q3,144,48,BILINGUAL (ARABIC AND PUNJABI IN PERSIAN CHARACTER)—RELIGION.,Bilingual (Arabic Punjabi),Persian,Religion,1,752,500,"Faiz-i-'Am Press, Lahore.",Faiz-i-A'm Press,Lahore,Muhammad Najm-ud-din,Umda-tal Khitab fi Fazail-il-Ashab,True,"A booklet describing the virtues and excellencies of Muhammad's companions, with quotations from the Quran and traditions, translated in Punjabi verse.",60 and 4,Author,Shádiwál,1910-06-26,4 annas,1st,8°,litho.,,,,,Bilingual (Arabic and Punjabi),,Faiz-i-A'm Press,Lahore,Author,Shadiwal,64,[]
1910Q3,144,48,BILINGUAL (ARABIC AND PUSHTO) POETRY.,Bilingual (Arabic Pushto),,Poetry,1,922,1500,"Newal Kishore Press, Lahore.",Newal Kishore Press,Lahore,,Majmua-i-Khutab-i-Kalan-i-Afghani,True,A collection of sermons recited immediately before the Juma and after the 'Id prayers.,48,"Muhammad Ayyub, Book-seller",Pesháwar,1910-05,9 pies,1st,8°,litho.,,,Date given only as May 1910.,,Bilingual (Arabic and Pushto),,Newal Kishore Press,Lahore,"Muhammad Ayyub, Book-seller",Peshawar,48,[]
