quarter,pdf_page,printed_page,section,lang,char,topic,serial,reg,copies,printer_verbatim,printer,pcity,author,title,title_native,gloss,pp_verbatim,publisher,pubcity,date,price,edition,format,method,educ,copyright,notes,marks,norm_lang,periodical,norm_printer,norm_pcity,norm_publisher,norm_pubcity,pp_sum,flags_json
1911Q1,195,2,ARABIC—ART.,Arabic,,Art,1,206,2000,"Newal Kishore Press, Lahore.",Newal Kishore Press,Lahore,,Kita-i-Panjtan,True,"a sheet containing the names of Allah, Muhammad, Ali, Fatima, Hasan & Husain, designed by M. Ghulam Muhi-ud-din, Lahore.",One sheet,the designer,Lahore,1911-01 (1329 Hijri),"Price, 1 anna 6 pies.",1st,14″ × 9.″,litho.,,"Maulvi Ghulam Muhi-ud-din, Lahore; No. 15, dated the 11th February 1911.",,X,Arabic,,Newal Kishore Press,Lahore,the designer,Lahore,,[]
1911Q1,195,2,ENGLISH—HISTORY.,English,,History,1,104,500,"The Punjab Educational Printing Works, Lahore.",The Punjab Educational Printing Works,Lahore,"Clan, H. R.",A Guide to the histories of Greece and Rome,False,,134,"the Scholars' Own Repository, Book-sellers",Lahore,1910-12-05,"Price, 8 annas.",1st,16°,,Y,,,,English,,Punjab Educational Printing Works,Lahore,"the Scholars' Own Repository, Book-sellers",Lahore,134,[]
1911Q1,195,2,ENGLISH—MEDICINE.,English,,Medicine,1,202,1000,"Punjab Economical Press, Lahore.",Punjab Economical Press,Lahore,,A Guide to Clinical Work for the use of Students,False,"This small pamphlet contains direction for the examination of urine and blood, compiled by M. Ghulam Rassul, Mayo Hospital, Lahore.",19,the compiler,Lahore,1911-01-04,"Price, 4 annas.",1st,16°,,Y,,,,English,,Punjab Economical Press,Lahore,the compiler,Lahore,19,[]
1911Q1,195,2,ENGLISH—MISCELLANEOUS.,English,,Miscellaneous,1,210,1000,"Jiwan Press, Lahore",Jiwan Press,Lahore,,General Information regarding the Dev Samaj,False,"Edited by Pandit Dev Ratan, Lahore.",4,The Dev Samaj,Lahore,1911-01-08,Free.,1st,8°,,,,,,English,,Jiwan Press,Lahore,The Dev Samaj,Lahore,4,"[{""field"": ""serial"", ""issue"": ""serial number partly obscured, appears to be 1""}]"
1911Q1,195,2,ARABIC—ART.,Arabic,,Art,2,207,1000,Ditto,Newal Kishore Press,Lahore,,Asma-i-Panjtan,True,"a sheet containing the names, noted in the above entry, designed by M. Ghulam Muhi-ud-din, Lahore.",One sheet,the designer,Lahore,1911-01 (1329 Hijri),"Price, 3 annas",1st,22 × 29,litho.,,"Maulvi Ghulam Mahi-ud-din, Lahore; No. 16, dated the 11th February, 1911.",,,Arabic,,Newal Kishore Press,Lahore,the designer,Lahore,,[]
1911Q1,195,2,ENGLISH—HISTORY.,English,,History,2,218,1000,Ditto,The Punjab Educational Printing Works,Lahore,"Muhammad Husain, Maulvi, Azad, Shams-ul-Ulama.","Qassas-i-Hind, part II",False,"An English translation of Qasas-i-Hind or stories from the Indian History, Part II, by Bawa Chhajju Singh.","220, 2","The Scholars' Own Repository, Book-sellers",Lahore,1910-12-24,"Price, 10 annas.",2nd,16°,,Y,,[Previous edition noticed in entry No. 8 at page 3 of the catalogue for the quarter ending the 31st March 1907.],,English,,Punjab Educational Printing Works,Lahore,"The Scholars' Own Repository, Book-sellers",Lahore,222,[]
1911Q1,195,2,ENGLISH—MISCELLANEOUS.,English,,Miscellaneous,2,220,1000,"Punjab Educational Printing Works, Lahore.",Punjab Educational Printing Works,Lahore,Helps. Sir Arthur,"Friends in Council, First Series",False,Essays on miscellaneous subjects.,492,"The Scholars' Own Repository, Book-sellers",Lahore,1910-12-13,"Price, Rs. 2, 8 annas.",2nd,16°,,,,[Previous edition noticed in entry No.    at page    of the catalogue for the quarter ending the    ],,English,,Punjab Educational Printing Works,Lahore,"The Scholars' Own Repository, Book-sellers",Lahore,492,[]
1911Q1,195,2,ENGLISH—MISCELLANEOUS.,English,,Miscellaneous,3,236,3000,"Punjab Printing Works, Lahore.",Punjab Printing Works,Lahore,"Kaushla Nandan Sahay, B.A.",Professor Rama Murti's exercises,False,"An illustrated book on Rama Murti's system of physical training, containing also a brief account of the feats of strength performed and the medals won by him.",29,the author,Lahore,1910-12,"Price, 6 annas.",1st,8°,,,,,,English,,Punjab Printing Works,Lahore,the author,Lahore,29,[]
1911Q1,196,3,ENGLISH—POETRY.,English,,Poetry,1,290,1000,"""Civil and Military Gazette"" Press, Lahore.","""Civil and Military Gazette"" Press",Lahore,,Damfool Smith Pote.,False,A book which contains verses and sketches.,89,,,1911-01-10,"Price, Re. 1.",1st,8°,,,"Major A. A. Irvine, Divisional, Judge, Lahore; No. 23, dated 9th February 1911.",,,English,,"""Civil and Military Gazette"" Press",Lahore,,,89,[]
1911Q1,196,3,ENGLISH—RELIGION.,English,,Religion,1,209,500,"Jiwan Press, Lahore.",Jiwan Press,Lahore,"Dev Ratan, Pandit.","The Four Great Principles relating to the life of man as discovered and taught by Shri Dev Guru Bhagwan, read at the Convention of Religions held at Allahabad in January 1911.",False,,13,Dev Samaj,Lahore,1911-01-07,"Price, 6 pies.",1st,16°,,,,,,English,,Jiwan Press,Lahore,Dev Samaj,Lahore,13,[]
1911Q1,196,3,ENGLISH—RELIGION.,English,,Religion,2,135,1000,"Wazir-i-Hind Press, Amritsar.",Wazir-i-Hind Press,Amritsar,"Jodh Singh, Bhai.","A paper on Sikhism, read before the Calcutta Religious Convention held in April 1909.",False,,16,Khalsa National Agency,Amritsar,1910-12-09,"Price, 1 anna.",2nd,16°,,,,,,English,,Wazir-i-Hind Press,Amritsar,Khalsa National Agency,Amritsar,16,[]
1911Q1,196,3,ENGLISH—RELIGION.,English,,Religion,3,288,500,"Royal Press, Rawalpindi,",Royal Press,Rawalpindi,,"The Teachings of Nanak, I. Return good for evil.",False,"This pamphlet contains an English translation of some texts from the Sikh Grantha, with English notes and explanations, on the subject of returning good for evil.",18,Author (the compiler),,1911-03-06,Free.,1st,16°,,,,Compiled by Sham Singh of Ráwalpindi.,,English,,Royal Press,Rawalpindi,Author (the compiler),,18,"[{""field"": ""serial"", ""issue"": ""serial number faint/illegible, inferred 3""}]"
1911Q1,196,3,ENGLISH—MISCELLANEOUS—CONCLUDED.,English,,Miscellaneous,4,91,600,"The Tribune Press, Lahore.",The Tribune Press,Lahore,,"Report of the Proceedings of the twenty-fourth Indian National Congress held at Lahore on the 27th. 28th and 29th Decemher, 1909.",False,,"3, 130, 33",The Indian National Congress Committee,Lahore,1910-12-15,Free.,1st,4°,,Y,,,,English,,The Tribune Press,Lahore,The Indian National Congress Committee,Lahore,166,"[{""field"": ""printer_verbatim"", ""issue"": ""'Decemher' printed for December""}]"
1911Q1,196,3,ENGLISH—MISCELLANEOUS—CONCLUDED.,English,,Miscellaneous,6,241,1000,"Mercantile Press, Lahore.",Mercantile Press,Lahore,,"A Glossary of Technical Terms used in Physical Geography by the Manager of ""The Teacher,"" Dinga, Gujrat.",False,,14,Author (the compiler),,1910-12,"Price, 2 annas.",1st,8°,,,,,,English,,Mercantile Press,Lahore,Author (the compiler),,14,[]
1911Q1,196,3,ENGLISH—MISCELLANEOUS—CONCLUDED.,English,,Miscellaneous,6,219,1000,"Punjab Educational Printing Works, Lahore.",Punjab Educational Printing Works,Lahore,"Ghosh, J. B.",Notes on Helps' Friends in Council (1st series),False,,"5, 183","The Scholars' Own Repository, Book-sellers",Lahore,1910-12-27,"Price, Re. 1, 8 annas.",2nd,16°,,,,,,English,,Punjab Educational Printing Works,Lahore,"The Scholars' Own Repository, Book-sellers",Lahore,188,"[{""field"": ""serial"", ""issue"": ""printed 6 but sequence expects 5; ambiguous digit""}]"
1911Q1,196,3,ENGLISH—MISCELLANEOUS—CONCLUDED.,English,,Miscellaneous,7,233,1000,"Punjab Printing Works, Lahore.",Punjab Printing Works,Lahore,"Rura Ram, Lala, B. A.",Special aids to Physical Geography.,False,,62,Author,Lahore,1910-12,"Price, 6 annas.",1st,8°,,,,,,English,,Punjab Printing Works,Lahore,Author,Lahore,62,[]
1911Q1,197,4,ENGLISH—SCIENCE (MATHEMATICAL).,English,,Science (Mathematical),1,240,1000,"Mercantile Press, Lahore.",Mercantile Press,Lahore,"Asaf, J. D.",Success in Mathematics.,False,"[This book contains solutions of questions in Algebra, Arithmetic and Geometry.]",80,Author,Lahore,1910-12,"Price, 10 annas.",1st,8°,,Y,,,,English,,Mercantile Press,Lahore,Author,Lahore,80,[]
1911Q1,197,4,ENGLISH—SCIENCE (NATURAL).,English,,Science (Natural),1,242,200,"Mercantile Press, Lahore.",Mercantile Press,Lahore,"Manohar Lal, Lala.",Notes on Metals with Table of Analysis.,False,,45,Author,Lahore,1910-12,Free.,1st,8°,,,,,,English,,Mercantile Press,Lahore,Author,Lahore,45,[]
1911Q1,197,4,ENGLISH—TRAVELS.,English,,Travels,1,105,1000,"The Punjab Educational Printing Works, Lahore.",The Punjab Educational Printing Works,Lahore,,"Notes on Robert Louis Stevenson's Inland Voyage, by Revd. E. D. Lucas.",False,,"5, 132","Scholars' Own Repository, Book-sellers, Lahore",Lahore,1910-12-10,"Price Re. 1, annas 8.",1st,8°,,Y,,,X,English,,Punjab Educational Printing Works,Lahore,"Scholars' Own Repository, Book-sellers, Lahore",Lahore,137,[]
1911Q1,197,4,HINDI—MISCELLANEOUS.,Hindi,,Miscellaneous,1,239,500,"Punjab Printing Works, Lahore.",Punjab Printing Works,Lahore,,Amritsar Pinjrapol,True,or the seventh Annual Report of the Cow Protection Society of Amritsar which maintains a charitable cattle-range.],"7, 36",Secretary of the Society,,1910-12,Free.,1st,8°,,,,,,Hindi,,Punjab Printing Works,Lahore,Secretary of the Society,,43,[]
1911Q1,197,4,ENGLISH—TRAVELS.,English,,Travels,2,289,800,"""Civil and Military Gazette"" Press, Lahore.","""Civil and Military Gazette"" Press",Lahore,,"The Tourist's Guide to Kashmir, Ladakh, Skardo, &c., edited by Arthur Neve, F. R. C. S., Surgeon to the Kashmir Medical Mission.",False,,225,,,1911-01-15,"Price, Rs. 2.",8th,8°,,,"Dr. Arthur Neve, F.R.C.S., Medical Mission, Srinagar, Kashmir. No. 22, dated the 9th February, 1911.",,X,English,,"""Civil and Military Gazette"" Press",Lahore,,,225,[]
1911Q1,197,4,HINDI—MISCELLANEOUS.,Hindi,,Miscellaneous,2,78,1000,"Jiwan Press, Lahore.",Jiwan Press,Lahore,,Dev Samaj ke sambandh men janne ke yogya kuchh sadharan baten,True,A few distinguishing features of the Dev Samaj and the work done by that body.],4,"The Secretary of the Samaj, Lahore",Lahore,1910-12-15,Free.,1st,8°,,,,,,Hindi,,Jiwan Press,Lahore,"The Secretary of the Samaj, Lahore",Lahore,4,[]
1911Q1,197,4,HINDI—MISCELLANEOUS.,Hindi,,Miscellaneous,3,29,500,"""The Civil and Military Organ"" Press, Ludhiána.","""The Civil and Military Organ"" Press",Ludhiána,,Ganeshi Lal Arya Kanya Pathshala ki Barshik Report,True,"or the report of the Arya Girls' School, Ludhiána, for the year 1909-10.]",28,Secretary of the institution,,1910-09-25,Free.,1st,8°,,,,,,Hindi,,"""The Civil and Military Organ"" Press",Ludhiana,Secretary of the institution,,28,[]
1911Q1,197,4,HINDI—MISCELLANEOUS.,Hindi,,Miscellaneous,4,224,1000,"Bombay Press, Lahore.",Bombay Press,Lahore,"Gobind Ram, Pandit.",Go Mahima Prakash,True,in which the Author gives quotations from Sanskrit authoritative books to shew that the cow was always revered in India.],77,Author,,1910-12-18,"Price, 4 annas.",1st,8°,,,,,X,Hindi,,Bombay Press,Lahore,Author,,77,[]
1911Q1,198,5,HINDI—MISCELLANEOUS—CONCLUDED.,Hindi,,Miscellaneous,,65,1000,"Imperial Book Depôt Press, Delhi.",Imperial Book Depôt Press,Delhi,,Shak Bhaji,True,"or a Hindi translation of Sabzi Tarkari, a book on vegetables by Lala Devi Dayal, noticed in entry No. 159 at page 29 of the Catalogue for the quarter ending 30th September 1907.",287,The Imperial Book Depôt,Delhi,1910-11-18,"Re. 1, 2 annas",1st,16°,,,"Imperial Book Depôt, Delhi; No. 6, dated 18th January 1911.",,,Hindi,,Imperial Book Depot Press,Delhi,The Imperial Book Depot,Delhi,287,"[{""field"": ""serial"", ""issue"": ""serial number illegible in margin""}]"
1911Q1,198,5,HINDI—MISCELLANEOUS—CONCLUDED.,Hindi,,Miscellaneous,,292,1000,"Bombay Press, Lahore.",Bombay Press,Lahore,"Shradhe Prakash Dev, B.",Stri Charitar,True,"or a moral book meant for women containing, discourses on moral subjects, illustrated by stories of good women.","244, 2",Author,Lahore,1911-01-26,12 annas,1st,16°,,,,,,Hindi,,Bombay Press,Lahore,Author,Lahore,246,"[{""field"": ""serial"", ""issue"": ""serial number illegible in margin""}]"
1911Q1,198,5,HINDI—MISCELLANEOUS—CONCLUDED.,Hindi,,Miscellaneous,,79,500,"Jiwan Press, Lahore.",Jiwan Press,Lahore,,Shri Devguru Bhagwan ki Ayu ka Sathwan Varsh,True,"or an account of the sayings and doings of Pandit S. N. Agnihotri, the founder of the Deva Samaj, Lahore.",17,Amar Singh,Lahore,1910-12-15,Free,1st,8°,,,,,,Hindi,,Jiwan Press,Lahore,Amar Singh,Lahore,17,"[{""field"": ""serial"", ""issue"": ""serial number illegible in margin""}]"
1911Q1,198,5,HINDI—POETRY.,Hindi,,Poetry,1,238,500,"Punjab Printing Works, Lahore.",Punjab Printing Works,Lahore,"Amin Chand, Sharma.",Kalyan Shatak,True,or one hundred Hindi couplets (Dohas) on moral subjects.,13,Dev Samaj,Lahore,1910-12,1 anna,1st,16°,,,,,Rejected 28 JUN 1917 stamp,Hindi,,Punjab Printing Works,Lahore,Dev Samaj,Lahore,13,"[{""field"": ""title"", ""issue"": ""obscured by stamp""}, {""field"": ""gloss"", ""issue"": ""obscured by stamp""}]"
1911Q1,198,5,HINDI—POETRY.,Hindi,,Poetry,2,77,500,Ditto,Punjab Printing Works,Lahore,"Amin Chand, Sharma.",Naitik Sangit,True,or moral songs for children.,32,Amar Singh,Lahore,1910-12-18,1 anna,1st,32°,,,,,,Hindi,,Punjab Printing Works,Lahore,Amar Singh,Lahore,32,[]
1911Q1,198,5,HINDI—POETRY.,Hindi,,Poetry,3,237,500,Ditto,Punjab Printing Works,Lahore,"Amin Chand, Sharma.",Shubh Path Pradarshak,True,or a collection of poems on moral and religious subjects.,72,Dev Samaj,Lahore,1910-12,3 annas,1st,16°,,,,,Rejected / Destroyed 28 JUN 1917 stamps,Hindi,,Punjab Printing Works,Lahore,Dev Samaj,Lahore,72,"[{""field"": ""gloss"", ""issue"": ""obscured by stamp""}, {""field"": ""date"", ""issue"": ""day obscured by stamp""}, {""field"": ""edition"", ""issue"": ""edition ordinal obscured by stamp""}]"
1911Q1,198,5,HINDI—POETRY.,Hindi,,Poetry,4,221,200,"Bombay Press, Lahore.",Bombay Press,Lahore,"Baldev Singh, Tikka Guler.",Sahaura Mahatimya Prakash,True,"or poems in the praise of a Sadhu who lived in Sahaura, a village in the Gurdáspur district, with some devotional verses.",29,Author,,1910-12-01,Free,1st,8°,,,,,,Hindi,,Bombay Press,Lahore,Author,,29,"[{""field"": ""serial"", ""issue"": ""serial number faint in margin""}]"
1911Q1,198,5,HINDI—MISCELLANEOUS—CONCLUDED.,Hindi,,Miscellaneous,8,201,500,"Punjab Economical Press, Lahore.",Punjab Economical Press,Lahore,"Bhanu Datta, Pandit.",Patrmala,True,or a Hindi letter-writer.,62,Author,Lahore,1911-12-31,2 annas,2nd,16°,,Y,,,,Hindi,,Punjab Economical Press,Lahore,Author,Lahore,62,[]
1911Q1,199,6,HINDI—RELIGION.,Hindi,,Religion,1,93,1000,"Jiwan Press, Lahore.",Jiwan Press,Lahore,"Dev Ratan, P.",Dev Samaj ka Ghoshan Patr,True,"[Dev Samaj ka Ghoshan Patr, or a proclamation by the Dev Samaj that their Guru or spiritual teacher is an incarnation of Dharma, that the tenets of the Samaj are founded on reason, &c.]",2,Author,,1910-12-15,Free,1st,8°,,,,,X,Hindi,,Jiwan Press,Lahore,Author,,2,[]
1911Q1,199,6,HINDI—RELIGION.,Hindi,,Religion,2,211,1000,Ditto,Jiwan Press,Lahore,,Dev Samaj ke sanbandh men ek Viceroy aur Governor-General Hindustan aur do Lieutenant-Governors ki Rai,True,"[Dev Samaj ke sanbandh men ek Viceroy aur Governor-General Hindustan aur do Lieutenant-Governors ki Rai, or the opinions of one Viceroy and two Lieutenant-Governors about the work done by the Dev Samaj.]",2,P. Dev Ratan,Lahore,1911-01-08,Free,1st,8°,,,,,X,Hindi,,Jiwan Press,Lahore,P. Dev Ratan,Lahore,2,[]
1911Q1,199,6,HINDI—RELIGION.,Hindi,,Religion,3,232,2000,"Punjab Printing Works, Lahore.",Punjab Printing Works,Lahore,,Dharma Shikshaka,True,"[Dharma Shikshaka, or an abstract of the teachings of Swami Daya Nand Saraswati, the founder of the Arya Samaj, as given in his book entitled Satyartha Prakasha, with quotations in Sanskrit.]",183,Arya Pradeshak Pratinadi Sabha,Punjab,1910-12 (Sambat 1967 B.),"Price, 6 annas",1st,8°,,,,,X,Hindi,,Punjab Printing Works,Lahore,Arya Pradeshak Pratinadi Sabha,Punjab,183,[]
1911Q1,199,6,HINDI—RELIGION.,Hindi,,Religion,4,294,2000,"Bombay Press, Lahore.",Bombay Press,Lahore,"Jodh Sihgh, Bhai",Vyakhyan Sikh Dharm par,True,"[Vyakhyan Sikh Dharm par, or a lecture on the Sikh religion.]",20,Khalsa National Agency,Amritsar,1911-01-01,"Price, 1 anna",1st,8°,,,,,X,Hindi,,Bombay Press,Lahore,Khalsa National Agency,Amritsar,20,"[{""field"": ""author"", ""issue"": ""'Sihgh' likely 'Singh' as printed""}]"
1911Q1,199,6,HINDI—POETRY—CONCLUDED.,Hindi,,Poetry,5,112,1000,"Rajeshwari Press, Ráwalpindi.",Rajeshwari Press,Ráwalpindi,"Chatur Das, Suri.",Chatur Pramod,True,"[Chatur Pramod, or poems on moral and religious subjects, some of which are in the form of stories.]",42,Author,Ráwalpindi,1911-01-04,Free,1st,16°,,,,,,Hindi,,Rajeshwari Press,Rawalpindi,Author,Rawalpindi,42,[]
1911Q1,199,6,HINDI—POETRY—CONCLUDED.,Hindi,,Poetry,6,228,2000,"Balmukand Press, Lahore.",Balmukand Press,Lahore,Ishar Das.,Kafiyan,True,"[Kafiyan, or devotional poems.]",62,"Kishan Gopal, Bal Ram",Lahore,1910-12-29,"Price, 1 anna",1st,8°,,,,,,Hindi,,Balmukand Press,Lahore,"Kishan Gopal, Bal Ram",Lahore,62,[]
1911Q1,199,6,HINDI—POETRY—CONCLUDED.,Hindi,,Poetry,7,204,1000,"Punjab Economical Press, Lahore.",Punjab Economical Press,Lahore,,Rama Prakasha,True,"[Rama Prakasha, or a collection of devotional poems dealing chiefly with the history of Rama, the incarnation of Vishnu.]",56,Diwan Krishn Kishore,Lahore,1911-01-15 (Sambat 1967 B.),"Price, 2 annas",1st,16°,,,,,,Hindi,,Punjab Economical Press,Lahore,Diwan Krishn Kishore,Lahore,56,[]
1911Q1,199,6,HINDI (IN THE PERSIAN CHARACTER)—POETRY.,Hindi,Persian character,Poetry,8,62,500,"McKey Press, Gujránwála.",McKey Press,Gujránwála,"Piare Lal, Lala.",Izhar-i-Muhabbat,True,[Izhar-i-Muhabbat. Devotional verses.],24,M. Muhammad Din,Gujránwála,1910-12-12,"Price, 6 pies",1st,16°,litho.,,,,,Hindi,,McKey Press,Gujranwala,M. Muhammad Din,Gujranwala,24,[]
1911Q1,200,7,HINDI—SCIENCE (MATHEMATICAL.),Hindi,,Science (Mathematical),1,216,5000,"Punjab Educational Printing Works, Lahore.",Punjab Educational Printing Works,Lahore,"Asha Ram, Master","Ganit Bhushan, Part I. Arithmetic for schools.",True,,162,Kannya Maha Vidyalaya Pustakalaya,Jullundur,1910-12-16,"2 annas, 6 pies",2nd,16°,,Y,,,,Hindi,,Punjab Educational Printing Works,Lahore,Kannya Maha Vidyalaya Pustakalaya,Jullundur,162,[]
1911Q1,200,7,HINDI—SCIENCE (NATURAL).,Hindi,,Science (Natural),1,87,2000,"Mufid-i-'Am Press, Lahore.",Mufid-i-'Am Press,Lahore,,"Padarth Vidya, Pratham Bhag",True,"A Hindi translation of Balfour Stewart's Physics Primer with a chapter on Mechanical Powers added, by Ram Lal Kanwar.",368,Messrs. Gulab Singh and Sons,Lahore,1910-12-06,"6 annas, 1 pie",1st,16°,,Y,"The Punjab Text-Book Committee, Lahore, No. 9, dated 20th January 1911.",,,Hindi,,Mufid-i-Am Press,Lahore,Messrs. Gulab Singh and Sons,Lahore,368,[]
1911Q1,200,7,MULTANI—POETRY.,Multani,,Poetry,1,298,500,"Arya Press, Lahore",Arya Press,Lahore,"Ghulam Sadiq, Ghulam Shabbir",Masaib-ul-Abrar,True,Verses on the martyrdom of Imam Husain.,64,"Muhammad Khair-ud-din, Fakhr-ud-din and Bashir-ud-din, Booksellers",Multan,1911-01 (1329),4 annas,1st,8°,litho.,,,,X,Multani,,Arya Steam Press,Lahore,"Muhammad Khair-ud-din, Fakhr-ud-din and Bashir-ud-din, Booksellers",Multan,64,"[{""field"": ""title"", ""issue"": ""romanization of Arabic script uncertain""}]"
1911Q1,200,7,HINDI—SCIENCE (MATHEMATICAL.),Hindi,,Science (Mathematical),2,217,1000,Ditto,Punjab Educational Printing Works,Lahore,,Part II.,False,,66,,,1911-01-15,4 annas,2nd,16°,,Y,,,,Hindi,,Punjab Educational Printing Works,Lahore,,,66,[]
1911Q1,200,7,HINDI—SCIENCE (MATHEMATICAL.),Hindi,,Science (Mathematical),3,235,1000,Ditto,Punjab Educational Printing Works,Lahore,,Part III.,False,,165,,,1910-12,6 annas,1st,16°,,Y,,,,Hindi,,Punjab Educational Printing Works,Lahore,,,165,[]
1911Q1,200,7,HINDI RELIGION—CONCLUDED.,Hindi,,Religion,5,106,1000,"Punjab Educational Printing Works, Lahore.",Punjab Educational Printing Works,Lahore,,"Ramayana, Part I",True,"an adaptation of the Ramayana of Valmiki, by Babu Shiv Brit Lal, M. A. translated into Hindi from the Urdu edition, noted in entry No. at page of the Catalogue for the quarter ending .",476,Bharat Literature Company,Lahore,1910-12-11,"Re. 1, 4 annas",1st,16°,,,,,X,Hindi,,Punjab Educational Printing Works,Lahore,Bharat Literature Company,Lahore,476,[]
1911Q1,200,7,HINDI RELIGION—CONCLUDED.,Hindi,,Religion,6,107,1000,Ditto,Punjab Educational Printing Works,Lahore,,Part II.,True,,334,,,1910-12-20,"Re. 1, 8 annas",1st,16°,,,,,,Hindi,,Punjab Educational Printing Works,Lahore,,,334,[]
1911Q1,200,7,HINDI RELIGION—CONCLUDED.,Hindi,,Religion,7,81,1000,"Bombay Press, Lahore.",Bombay Press,Lahore,,"Dharma Shikshaka, Sankhya 6",True,"or the sixth religious reader for the First Middle Class, compiled in the light of the Arya Samaj tenets.",160,"Karya Karini Sabha, D.-A. V. College",Lahore,1910-11-15,6 annas,1st,8°,,Y,,"Kartik, Sambat 1967.",,Hindi,,Bombay Press,Lahore,"Karya Karini Sabha, D.-A. V. College",Lahore,160,[]
1911Q1,201,8,PERSIAN—POETRY.,Persian,,Poetry,1,119,500,"Brahman Press, Ráwalpindi.",Brahman Press,Ráwalpindi,"Abdul Aziz, Maulvi",Ism-i-Izzat-i-Aziz wa Nafi Isbat Har Dil Aziz,True,Devotional verses.,12,Author,Ráwalpindi,1910-06-01,,1st,8°,litho.,,,,,Persian,,Brahman Press,Rawalpindi,Author,Rawalpindi,12,[]
1911Q1,201,8,PUNJABI—ART.,Punjabi,,Art,1,32,750,"Aror Bans Press, Amritsar.",Aror Bans Press,Amritsar,"Jawahar Sihgh, B.",Wadda Viskarma Prakash,True,A treatise on architecture containing illustrations of decorations.,128,"B. Sukha Singh, Jiwan Singh",Amritsar,1910-12-01,"Price, 4 annas.",1st,8°,,,,,X,Punjabi,,Aror Bans Press,Amritsar,"B. Sukha Singh, Jiwan Singh",Amritsar,128,[]
1911Q1,201,8,PUNJABI—BIOGRAPHY.,Punjabi,,Biography,1,45,"1,000","Siri Gurmat Press, Amritsar.",Siri Gurmat Press,Amritsar,,"Jiwan Britant, Pehli Patshahi Siri Guru Nanak Sahib ji",True,"A brief account of the life and works of Guru Nanak, the founder of the Sikh religion.",47,The Sat Biwharak Agency,Amritsar,1910-11-05,"Price, 1 anna.",1st,16°,,,,,,Punjabi,,Sri Gurmat Press,Amritsar,The Sat Biwharak Agency,Amritsar,47,[]
1911Q1,201,8,MULTANI—POETRY—CONCLUDED.,Multani,,Poetry,2,303,500,"Arya Press, Lahore",Arya Press,Lahore,"Ghulam Sikandar Khan, Maulvi",Bayaz-i-Gam,True,Verses on the martyrdom of Imam Husain.,60,"Muhammad Khair-ud-din, Fakhr-ud-din and Bashir-ud-din, Book-sellers",Multán,1911-01 (1329),"Price, 4 annas.",1st,8°,litho.,,,,,Multani,,Arya Steam Press,Lahore,"Muhammad Khair-ud-din, Fakhr-ud-din and Bashir-ud-din, Book-sellers",Multan,60,[]
1911Q1,201,8,MULTANI—POETRY—CONCLUDED.,Multani,,Poetry,3,300,500,Ditto,Arya Press,Lahore,"Khuda Bakhsh, Maulvi",Durr-i-Maknun,True,Verses on the martyrdom of Imam Husain.,64,"Muhammad Khair-ud-din, Fakhr-ud-din and Bashir-ud-din, Book-sellers",Multán,1911-01 (1329),"Price, 4 annas.",1st,8°,litho.,,,,,Multani,,Arya Steam Press,Lahore,"Muhammad Khair-ud-din, Fakhr-ud-din and Bashir-ud-din, Book-sellers",Multan,64,"[{""field"": ""date"", ""issue"": ""Hiiri printed for Hijri""}]"
1911Q1,201,8,MULTANI—POETRY—CONCLUDED.,Multani,,Poetry,4,299,500,Ditto,Arya Press,Lahore,"Safdar Ali Muhammad Khan, Maulvi",Gulshan-i-Jawed,True,Verses on the martyrdom of Imam Husain.,60,"Muhammad Khair-ud-din, Fakhr-ud-din and Bashir-ud-din, Book-sellers",Multán,1911-01 (1329),"Price, 4 annas.",1st,8°,litho.,,,,X,Multani,,Arya Steam Press,Lahore,"Muhammad Khair-ud-din, Fakhr-ud-din and Bashir-ud-din, Book-sellers",Multan,60,[]
1911Q1,201,8,MULTANI—POETRY—CONCLUDED.,Multani,,Poetry,5,301,500,Ditto,Arya Press,Lahore,"Sardar Ali Shah, Sayad",Hamla-i-Haidri,True,Verses describing the battles fought by Ali and the martyrdom of Imam Husain.,48,"Muhammad Khair-ud-din, Fakhr-ud-din and Bashir-ud-din, Book-sellers",Multán,1911-01 (1329),"Price, 3 annas.",1st,8°,litho.,,,,,Multani,,Arya Steam Press,Lahore,"Muhammad Khair-ud-din, Fakhr-ud-din and Bashir-ud-din, Book-sellers",Multan,48,[]
1911Q1,201,8,MULTANI—POETRY—CONCLUDED.,Multani,,Poetry,6,302,500,Ditto,Arya Press,Lahore,"Wasif Husain, Sayad",Izhar-ush-Shahadatain,True,Verses describing the martyrdom of Ali and his son Husain.,52,"Muhammad Khair-ud-din, Fakhr-ud-din and Bashir-ud-din, Book-sellers",Multán,1911-01 (1329),"Price, 4 annas.",1st,8°,litho.,,,,,Multani,,Arya Steam Press,Lahore,"Muhammad Khair-ud-din, Fakhr-ud-din and Bashir-ud-din, Book-sellers",Multan,52,[]
1911Q1,202,9,PUNJABI—FICTION.,Punjabi,,Fiction,1,130,1000,"Wazir-i-Hind Press, Amritsar.",Wazir-i-Hind Press,Amritsar,"Mansa Singh, B.",Dhiyan da Banaj or a story,True,setting forth the evil results of marrying girls to undesirable men for the sake of pecuniary gain.,91,"B. Labh Singh, Gyani",Amritsar,1910-12-05,3 annas,2nd,8°,,,,,,Punjabi,,Wazir-i-Hind Press,Amritsar,"B. Labh Singh, Gyani",Amritsar,91,[]
1911Q1,202,9,PUNJABI—LANGUAGE.,Punjabi,,Language,1,151,1000,"Siri Gurmat Press, Amritsar.",Siri Gurmat Press,Amritsar,"Karnail Singh, B.",Bal Bodh,True,A Punjabi Primer.,32,B. Dilail Singh,Hoshiárpur,1911-01-03,1 anna,1st,16°,,Y,,,,Punjabi,,Sri Gurmat Press,Amritsar,B. Dilail Singh,Hoshiarpur,32,[]
1911Q1,202,9,PUNJABI—FICTION.,Punjabi,,Fiction,2,145,2000,Ditto,Wazir-i-Hind Press,Amritsar,,Pritam Ji,True,A story illustrative of the fact that one cannot attain communion with God without an ardent love of Him.,144,The Khalsa Tract Society,Amritsar,1910-12-21,2 annas 6 pies,1st,16°,,,,,,Punjabi,,Wazir-i-Hind Press,Amritsar,Khalsa Tract Society,Amritsar,144,[]
1911Q1,202,9,PUNJABI—FICTION.,Punjabi,,Fiction,3,142,2000,Ditto,Wazir-i-Hind Press,Amritsar,,Pyare da pyara,True,A story illustrating the love of the Sikhs towards their Gurus.,120,The Khalsa Tract Society,Amritsar,1910-12-16,2 annas,1st,16°,,,,,,Punjabi,,Wazir-i-Hind Press,Amritsar,Khalsa Tract Society,Amritsar,120,[]
