quarter,pdf_page,printed_page,section,lang,char,topic,serial,reg,copies,printer_verbatim,printer,pcity,author,title,title_native,gloss,pp_verbatim,publisher,pubcity,date,price,edition,format,method,educ,copyright,notes,marks,norm_lang,periodical,norm_printer,norm_pcity,norm_publisher,norm_pubcity,pp_sum,flags_json
1911Q1,216,23,PUNJABI (IN THE PERSIAN CHARACTER)—POETRY—CONTINUED.,Punjabi,Persian character,Poetry,95,37,550,Ditto,Arorbans Press,Amrisar,,Naya Qissa Nunh Sohra,True,The story of the illicit love of a father-in-law towards his daughter-in-law.,8,"Bhai Chatar Singh Jiwan Singh, book-sellers",Amritsar,1910-12-09,"Price, 6 pries.",1st,8°,litho.,,,,,Punjabi,,Arorbans Press,Amrisar,"Bhai Chatar Singh Jiwan Singh, book-sellers",Amritsar,8,[]
1911Q1,216,23,PUNJABI (IN THE PERSIAN CHARACTER)—POETRY—CONTINUED.,Punjabi,Persian character,Poetry,96,36,550,Ditto,Arorbans Press,Amrisar,Wisakha Singh,Qissa-i-Dewar Bhabi,True,Verses describing the illicit love of a woman with her husband's younger brother.,8,"Chatar Singh Jiwan Singh, book-sellers",Amritsar,1910-12-08,"Price, 6 pies.",1st,8°,litho.,,,,,Punjabi,,Arorbans Press,Amrisar,"Chatar Singh Jiwan Singh, book-sellers",Amritsar,8,[]
1911Q1,216,23,PUNJABI (IN THE HINDI CHARACTER)—POETRY.,Punjabi,Hindi character,Poetry,97,231,1000,"Balmukand Press, Lahore.",Balmukand Press,Lahore,"Chuni Lal, Rai, P.",Chuni Baran Masa Bairag,True,or devotional verses in the form of a calendar.,,Author,,1911-01-01,"Price, 3 pies.",1st,8°,,,,,,Punjabi,,Balmukand Press,Lahore,Author,,,[]
1911Q1,217,24,PUNJABI—RELIGION—CONTINUED.,Punjabi,,Religion,2,156,500,"Siri Gurmat Press, Amritsar.",Siri Gurmat Press,Amritsar,,Anand Sahib Satik,True,"Select verses from the Sikh Grantha, with commentary, recited at the occasion of marriages among Sikhs.",38,B. Dalel Singh,Hoshiárpur,1911-01-07,"Price, 9 pies.",1st,16°,,,,,,Punjabi,,Sri Gurmat Press,Amritsar,B. Dalel Singh,Hoshiarpur,38,[]
1911Q1,217,24,PUNJABI—RELIGION—CONTINUED.,Punjabi,,Religion,3,144,"2,000",Ditto,Siri Gurmat Press,Amritsar,,Asa di War,True,Select verses from the Sikh Grantha.,48,The Khalsa Tract Society,Amritsar,1910-12-20,"Price, 1 anna.",1st,16°,,,,,,Punjabi,,Sri Gurmat Press,Amritsar,Khalsa Tract Society,Amritsar,48,[]
1911Q1,217,24,PUNJABI—RELIGION—CONTINUED.,Punjabi,,Religion,4,195,"1,000","Shri Gahr Gambhir Press, Rúpar.",Shri Gahr Gambhir Press,Rúpar,"Bishan Das, S.",Atam Bodhani Paintis Akhari Satik,True,"The letters of the Gurmukhi alphabet interpretted in spiritual light, with a commentary by Sadhu Shankar Das.",221,Author (the Commentator),Rúpar,1911-01-14,"Price, 8 annas.",1st,8°,,,,,,Punjabi,,Shri Gahr Gambhir Press,Rupar,Author (the Commentator),Rupar,221,[]
1911Q1,217,24,PUNJABI—RELIGION—CONTINUED.,Punjabi,,Religion,5,296,"1,000","Bombay Press, Lahore.",Bombay Press,Lahore,"Devendar Nath, Thakur.",Brahm Dharam,True,A discourse on the Brahmo Religion. Translad into Punjabi by Shradhi Prakash Dev.,133,Author (the translator),Lahore,1911-01-27,"Price, 6 annas.",1st,16°,,,,,,Punjabi,,Bombay Press,Lahore,Author (the translator),Lahore,133,"[{""field"": ""gloss"", ""issue"": ""'Translad' printed unclearly, likely 'Translated'""}]"
1911Q1,217,24,PUNJABI—RELIGION—CONTINUED.,Punjabi,,Religion,6,255,300,"Anglo - Urdu and Gurmukhi Press, Amritsar.",Anglo - Urdu and Gurmukhi Press,Amritsar,,Grantha Lal Prakashi,True,Select verses from the Sikh Grantha.,64,B. Bhagat Singh,Amritsar,1911-01-08,,1st,8°,,,,,,Punjabi,,Anglo - Urdu and Gurmukhi Press,Amritsar,B. Bhagat Singh,Amritsar,64,[]
1911Q1,217,24,PUNJABI—RELIGION—CONTINUED.,Punjabi,,Religion,7,173,"1,000","Gurmukhi Press, Peshàwar Cantonment.",Gurmukhi Press,Peshàwar Cantonment,,Gurmukhi Texts,False,Verses from the Sikh Granth in praise of the true Guru or spiritual leader.,1,The Sikh Book Club,Peshawar,1910-11-01,Free.,1st,,,,,Full foolscap sheet,,Punjabi,,Gurmukhi Press,Peshawar Cantonment,The Sikh Book Club,Peshawar,1,[]
1911Q1,217,24,PUNJABI—RELIGION—CONTINUED.,Punjabi,,Religion,8,191,350,Ditto,Gurmukhi Press,Peshàwar Cantonment,,No. 4,True,Verses from the Sikh Grantha on the transitory nature of the world,1,The Sikh Book Agency,Peshàwar Cantonment,1910-12-11,"Price, 6 pies.",1st,,,,,Full foolscap sheet,,Punjabi,,Gurmukhi Press,Peshawar Cantonment,The Sikh Book Agency,Peshawar Cantonment,1,[]
1911Q1,217,24,PUNJABI—RELIGION—CONTINUED.,Punjabi,,Religion,9,192,250,Ditto,Gurmukhi Press,Peshàwar Cantonment,,No. 5,True,A parable on the importance of devotion as a means of attaining spirutural greatness.,1,The Sikh Book Agency,Pesháwar Cantonment,1910-12-11,"Price, 6 pies.",1st,,,,,Full foolscap sheet,,Punjabi,,Gurmukhi Press,Peshawar Cantonment,The Sikh Book Agency,Peshawar Cantonment,1,[]
1911Q1,217,24,PUNJABI—RELIGION—CONTINUED.,Punjabi,,Religion,10,193,250,"Gurmukhi Press, Peshawar Cantonment.",Gurmukhi Press,Peshawar Cantonment,,No. 6,True,"A verse from the Sikh Graanth, showing the necessity of self-control.",1,The Sikh Book Agency,Peshawar Cantonment,1910-12-13,"Price, 6 pies.",1st,,,,,Full foolscap sheet,,Punjabi,,Gurmukhi Press,Peshawar Cantonment,The Sikh Book Agency,Peshawar Cantonment,1,[]
1911Q1,217,24,PUNJABI—RELIGION—CONTINUED.,Punjabi,,Religion,11,184,250,Ditto,Gurmukhi Press,Peshawar Cantonment,,No. 68,True,Verses from the Sikh Grantha descriptive of the peaceful nature of the religion of the Sikhs.,1,The Panch Khalsa Agency,Peshawar Cantonment,1910-08-20,"Price, 6 pies.",2nd,,,,,Full foolscap sheet,,Punjabi,,Gurmukhi Press,Peshawar Cantonment,The Panch Khalsa Agency,Peshawar Cantonment,1,[]
1911Q1,218,25,PUNJABI—RELIGION—CONTINUED.,Punjabi,,Religion,12,185,250,"Gurmukhi Press, Peshawar Cantonment.",Gurmukhi Press,Peshawar Cantonment,,Gurmukhi Texts. [No. 74.—Verses from the Sikh Grantha],True,"Verses from the Sikh Grantha, showing that the Sikh religion is free from the prejudices of the Hindus and the Muhammadans.",1,The Panch Khalsa Agency,Peshawar Cantonment,1910-08-20,"Price, 6 pies.",2nd,Full foolscap sheet,,,,,,Punjabi,,Gurmukhi Press,Peshawar Cantonment,The Panch Khalsa Agency,Peshawar Cantonment,1,[]
1911Q1,218,25,PUNJABI—RELIGION—CONTINUED.,Punjabi,,Religion,13,186,250,Ditto,Gurmukhi Press,Peshawar Cantonment,,[No. 24.—Verses from the Sikh Grantha],True,"Verses from the Sikh Grantha, condemning the use of offensive language.",1,The Panch Khalsa Agency,Peshawar Cantonment,1910-08-20,"Price, 6 pies.",1st,Full foolscap sheet,,,,,,Punjabi,,Gurmukhi Press,Peshawar Cantonment,The Panch Khalsa Agency,Peshawar Cantonment,1,[]
1911Q1,218,25,PUNJABI—RELIGION—CONTINUED.,Punjabi,,Religion,14,187,250,Ditto,Gurmukhi Press,Peshawar Cantonment,,[No. 118.—Verses from the Sikh Grantha],True,"Verses from the Sikh Grantha, setting forth the duties of husband and wife.",1,The Panch Khalsa Agency,Peshawar Cantonment,1910-08-25,"Price, 6 pies.",1st,Full foolscap sheet,,,,,,Punjabi,,Gurmukhi Press,Peshawar Cantonment,The Panch Khalsa Agency,Peshawar Cantonment,1,[]
1911Q1,218,25,PUNJABI—RELIGION—CONTINUED.,Punjabi,,Religion,15,188,1600,Ditto,Gurmukhi Press,Peshawar Cantonment,,[No. 59.—Verses from Guru Bilas],True,Verses from Guru Bilas on the subject of loyalty to Government.,1,The Panch Khalsa Agency,Peshawar Cantonment,1910-09-01,"Price, 6 pies.",4th,Full foolscap sheet,,,,,,Punjabi,,Gurmukhi Press,Peshawar Cantonment,The Panch Khalsa Agency,Peshawar Cantonment,1,[]
1911Q1,218,25,PUNJABI—RELIGION—CONTINUED.,Punjabi,,Religion,16,189,1100,Ditto,Gurmukhi Press,Peshawar Cantonment,,[No. 119.—Verses from the Sikh Grantha],True,Verses from the Sikh Grantha on the subject of faithfulness towards one's master.,1,The Panch Khalsa Agency,Peshawar Cantonment,1910-09-01,"Price, 6 pies.",1st,Full foolscap sheet,,,,,,Punjabi,,Gurmukhi Press,Peshawar Cantonment,The Panch Khalsa Agency,Peshawar Cantonment,1,[]
1911Q1,218,25,PUNJABI—RELIGION—CONTINUED.,Punjabi,,Religion,17,178,250,Ditto,Gurmukhi Press,Peshawar Cantonment,,[No. 120.—Verses from the Sikh Grantha],True,Verses from the Sikh Grantha in praise of a true Guru or spiritual leader.,1,The Panch Khalsa Agency,Peshawar Cantonment,1910-10-01,"Price, 6 pies.",1st,4°,,,,,,Punjabi,,Gurmukhi Press,Peshawar Cantonment,The Panch Khalsa Agency,Peshawar Cantonment,1,"[{""field"": ""format"", ""issue"": ""printed '4°' partly illegible""}]"
1911Q1,218,25,PUNJABI—RELIGION—CONTINUED.,Punjabi,,Religion,18,179,250,Ditto,Gurmukhi Press,Peshawar Cantonment,,[No. 121.—Verses on the importance of submission to the will of God],True,Verses on the importance of submission to the will of God.,1,The Panch Khalsa Agency,Peshawar Cantonment,1910-10-01,"Price, 6 pies.",1st,Foolscap sheet,,,,,,Punjabi,,Gurmukhi Press,Peshawar Cantonment,The Panch Khalsa Agency,Peshawar Cantonment,1,[]
1911Q1,218,25,PUNJABI—RELIGION—CONTINUED.,Punjabi,,Religion,19,180,250,Ditto,Gurmukhi Press,Peshawar Cantonment,,[No. 122.—Verses showing that afflictions and troubles are the inevitable results of disobedience to God],True,Verses showing that afflictions and troubles are the inevitable results of disobedience to God.,1,The Panch Khalsa Agency,Peshawar Cantonment,1910-10-01,"Price, 6 pies.",1st,Full foolscap sheet,,,,,,Punjabi,,Gurmukhi Press,Peshawar Cantonment,The Panch Khalsa Agency,Peshawar Cantonment,1,[]
1911Q1,218,25,PUNJABI—RELIGION—CONTINUED.,Punjabi,,Religion,20,181,250,Ditto,Gurmukhi Press,Peshawar Cantonment,,[No. 123.—Verses on the importance of prayer],True,Verses on the importance of prayer.,1,The Panch Khalsa Agency,Peshawar Cantonment,1910-10-01,"Price, 6 pies.",1st,Full foolscap sheet,,,,,,Punjabi,,Gurmukhi Press,Peshawar Cantonment,The Panch Khalsa Agency,Peshawar Cantonment,1,[]
1911Q1,219,26,SINDHI (IN THE ARABIC CHARACTER)—MISCELLANEOUS.,Sindhi,Arabic character,Miscellaneous,1,244,"1,000","Hamidiya Steam Press, Lahore.",Hamidiya Steam Press,Lahore,"Qalij Beg, Mirza.","مجالس الشهدا [Majalis-ush-Shuhada, or an account of the martyrdom of the Imams.]",True,,128,"Munshi Pokhar Das, book-seller",Shikarpur,1910-12-10,"Price, 12 annas.",1st,8°,litho.,,"Munshi Pokhar Das and Son, booksellers, Shikarpur; No. 19, dated the 11th February 1911.",,,Sindhi,,Hamidiya Steam Press,Lahore,"Munshi Pokhar Das, book-seller",Shikarpur,128,"[{""field"": ""copyright"", ""issue"": ""right margin partly cropped""}]"
1911Q1,219,26,PUNJABI—RELIGION—CONCLUDED.,Punjabi,,Religion,21,182,250,"Gurmukhi Press, Pesháwar Cantonment.",Gurmukhi Press,Pesháwar Cantonment,,Gurmukhi Texts. ਨੰਬਰ ੧੨੪ [No. 124.,True,Verses showing that every man has to abide by what fate has ordained for him.],1,The Panch Khalsa Agency,Pesháwar Cantonment,1910-10-01,"Price, 6 pies.",1st,Full foolscap sheet,,,,,,Punjabi,,Gurmukhi Press,Peshawar Cantonment,The Panch Khalsa Agency,Peshawar Cantonment,1,[]
1911Q1,219,26,PUNJABI—RELIGION—CONCLUDED.,Punjabi,,Religion,22,183,250,Ditto,Gurmukhi Press,Pesháwar Cantonment,,ਨੰਬਰ ੧੨੫ [No 125.,True,"Verses calling attention to opportunities for leading a life of purity, piety and godliness at the various stages of a man's life.]",1,The Panch Khalsa Agency,Pesháwar Cantonment,1910-10-14,"Price, 6 pies.",1st,Full foolscap sheet,,,,,,Punjabi,,Gurmukhi Press,Peshawar Cantonment,The Panch Khalsa Agency,Peshawar Cantonment,1,[]
1911Q1,219,26,PUNJABI—RELIGION—CONCLUDED.,Punjabi,,Religion,23,175,500,Ditto,Gurmukhi Press,Pesháwar Cantonment,,Motto No. 3.,False,[The Sikh exchange of compliments and war cry.],1,The Khalsa Book Agency,Pesháwar Cantonment,1910-11-29,Price 3 pies.,1st,Full foolscap sheet,,,,,,Punjabi,,Gurmukhi Press,Peshawar Cantonment,The Khalsa Book Agency,Peshawar Cantonment,1,[]
1911Q1,219,26,PUNJABI—RELIGION—CONCLUDED.,Punjabi,,Religion,24,174,"3,000",Ditto,Gurmukhi Press,Pesháwar Cantonment,,"ਪੈਸਾ ਲਾਇਬਰੇਰੀ ਸੀਰੀਜ ਨੰ: ੧ [Paisa Library Series, No. 1.",True,"A prayer of the Sikhs to Guru Nanak, the founder of Sikhism.]",1,The Sikh Book Agency,Pesháwar Cantonment,1910-11-14,"Price, Re. 1 per 100.",1st,Foolscap size,,,,,,Punjabi,,Gurmukhi Press,Peshawar Cantonment,The Sikh Book Agency,Peshawar Cantonment,1,[]
1911Q1,219,26,PUNJABI—RELIGION—CONCLUDED.,Punjabi,,Religion,25,230,"4,000","Balmukand Press, Lahore.",Balmukand Press,Lahore,,ਪੋਥੀ ਜਪੁਜੀ ਸਾਹਿਬ [Pothi Japuji Sahib.,True,Select verses from the Sikh Grantha recited in the morning prayer of the Sikhs.],32,B Daya Singh and Son,Lahore,1910-12-03,"Price, 3 pies.",1st,32°,,,,,,Punjabi,,Balmukand Press,Lahore,B Daya Singh and Son,Lahore,32,"[{""field"": ""date"", ""issue"": ""day partly illegible '3.th'""}]"
1911Q1,219,26,PUNJABI—RELIGION—CONCLUDED.,Punjabi,,Religion,26,146,"2,000","Wazir-i-Hind Press, Amritsar.",Wazir-i-Hind Press,Amritsar,,ਟਿੱਕੇ ਦੀ ਵਾਰ ਤੇ ਭਾਈ ਲਧਾ ਪਰ ਉਪਕਾਰੀ [Tikke di war te Bhai Ladha Par Upkari.,True,"An account of the quarrel that arose between the musicians and Guru Arjan, with an account of the unintended intervention of Bhai Ladha Part I.]",48,The Khalsa Tract Society,Amritsar,1910-12-22,"Price, 1 anna.",1st,16°,,,,,X,Punjabi,,Wazir-i-Hind Press,Amritsar,Khalsa Tract Society,Amritsar,48,[]
1911Q1,219,26,PUNJABI—RELIGION—CONCLUDED.,Punjabi,,Religion,27,147,"2,000",Ditto,Wazir-i-Hind Press,Amritsar,,"ਭਾਗ ੨ [Tikke di war te Bhai Ladha Par Upkari, Bhag 2.]",True,,48,The Khalsa Tract Society,Amritsar,1910-12-25,"Price, 1 anna.",1st,16°,,,,,X,Punjabi,,Wazir-i-Hind Press,Amritsar,Khalsa Tract Society,Amritsar,48,[]
1911Q1,219,26,PUNJABI—RELIGION—CONCLUDED.,Punjabi,,Religion,28,344,"1,000","Siri Gurmat Press, Amritsar.",Siri Gurmat Press,Amritsar,,੩ ਤਿੰਨ) ਸਾਖੀਆਂ [Tinn Sakhian.,True,Selection from the Sikh Grantha.],16,"B. Gurdit Singh, Photographer",Amritsar,1910-11-10,Free.,1st,16°,,,,,,Punjabi,,Sri Gurmat Press,Amritsar,"B. Gurdit Singh, Photographer",Amritsar,16,[]
1911Q1,220,27,URDU—BIOGRAPHY.,Urdu,,Biography,1,168,1000,"Roze Bazar Steam Press, Amritsar.",Roze Bazar Steam Press,Amritsar,"Amjad Ali, Sayad, Maulvi",Sawanih-i-Haidar Ali Sultan,True,"A detailed account of the life of Haidar Ali, who became king of Mysore in the latter half of the 18th century.","8, 4 8",The Vakil Trading Company,Amritsar,1910-12-29,12 annas,1st,16°,litho.,,,,X,Urdu,,Roze Bazar Steam Press,Amritsar,The Vakil Trading Company,Amritsar,8,[]
1911Q1,220,27,URDU—DRAMA.,Urdu,,Drama,1,94,500,"Hindustan Press, Lahore.",Hindustan Press,Lahore,"Habibullah, Asi, M.",Khubsurat Bala,True,"A drama in which a queen is deprived of her throne by an influential lady, but ultimately regains it through the faithful efforts of one of her generals.",80,"B. Maghi Ram Sant Ram, book-sellers",Amritsar,1910-11,4 annas,1st,8°,litho.,,,,,Urdu,,Hindustan Steam Press,Lahore,"B. Maghi Ram Sant Ram, book-sellers",Amritsar,80,[]
1911Q1,220,27,URDU—BIOGRAPHY.,Urdu,,Biography,2,326,1000,"Hindustan Press, Lahore.",Hindustan Press,Lahore,"Bala Ji, Bhai","Waddi Janam Sakhi, Guru Nanak Sahib ba Taswir",True,"or the life of Guru Nanak, illustrated, edition.",328,"B. Daya Singh, book-seller",Lahore,1911-01,Re. 1,2nd,8°,litho.,,,,X,Urdu,,Hindustan Steam Press,Lahore,"B. Daya Singh, book-seller",Lahore,328,[]
1911Q1,220,27,URDU—DRAMA.,Urdu,,Drama,2,311,1000,"Hamidiya Press, Lahore.",Hamidiya Press,Lahore,"Jauhar, M. S., Mr.",Amrit,True,or a drama in which a Wazir procures for his master innocent girls and in the end is punished for so doing by sending his own daughter to the prince by mistake.,64,"B. Daya Singh, book-seller",Lahore,1911-01-14,12 annas,1st,8°,litho.,,,,,Urdu,,Hamidiya Steam Press,Lahore,"B. Daya Singh, book-seller",Lahore,64,[]
1911Q1,220,27,URDU—BIOGRAPHY.,Urdu,,Biography,3,90,500,"Mohyal Mitr Press, Lahore.",Mohyal Mitr Press,Lahore,"Harji Mal, Lala",Phal Phul,True,"A brief account of the life of the author who is an Inspector of the Pioneer Flour Mills, Lahore, and of his travels in India.",136,Lala Harji Mal,Lahore,1910-11-20,Free,1st,8°,litho.,,,,X,Urdu,,Mohyal Mitr Press,Lahore,Lala Harji Mal,Lahore,136,[]
1911Q1,220,27,URDU—BIOGRAPHY.,Urdu,,Biography,4,279,375,"Mujaddidi Press, Amritsar.",Mujaddidi Press,Amritsar,"Muhammad Ibrahim Khan, Mian",Nur-i-Nihal-i-Qadiri,True,An account of the lives of some important Sufi saints of the Qadiriya order.,80,Author,"Mauza Jalala, Gurdaspur District",1911-01-10,4 annas,1st,8°,litho.,,,,X,Urdu,,Mujaddidi Press,Amritsar,Author,"Mauza Jalala, Gurdaspur District",80,[]
1911Q1,220,27,URDU—BIOGRAPHY.,Urdu,,Biography,5,109,1000,"Newal Kishore Steam Press, Lahore.",Newal Kishore Steam Press,Lahore,,Nasim-i-Yaman-fi-halat-i-Uwais-i-Qaran,True,"or a life of Khawaja Uwais, a well-known Muhammadan saint who was a contemporary of Muhammad, translated by Sayad Muhammad Ishfaq Husain Shah from a Persian original of Maulvi Ahmad bin Mahmud, entitled ""Lataif-i-Nafisia dar Fazail-i-Uwaisia.""",264,Muhammad Abdul Karim and Maulvi Muhammad Baqir,Lahore,1910-12,12 annas,1st,8°,litho.,,"Muhammad Abdul Karim and Maulvi Muhammad Baqir, Lahore; No. 10, dated the 20th January, 1911.",,X,Urdu,,Newal Kishore Steam Press,Lahore,Muhammad Abdul Karim and Maulvi Muhammad Baqir,Lahore,264,[]
1911Q1,221,28,URDU—FICTION.,Urdu,,Fiction,1,316,"1,000","Hindustan Press, Lahore.",Hindustan Press,Lahore,,"Auraton ke Chalitar, Hissa-i-Awwal",True,"or a book containing short stories describing the wiles of women, Part I.",40,"B. Maghi Ram Sant Ram, book-sellers",Amritsar,1911-01,4 annas,1st,8°,litho.,,,,,Urdu,,Hindustan Steam Press,Lahore,"B. Maghi Ram Sant Ram, book-sellers",Amritsar,40,[]
1911Q1,221,28,URDU—FICTION.,Urdu,,Fiction,2,317,"1,000",Ditto,Hindustan Press,Lahore,,—— Hissa-Duwam ——,True,Part II.,40,,,1911-01,4 annas,1st,8°,litho.,,,,,Urdu,,Hindustan Steam Press,Lahore,,,40,[]
1911Q1,221,28,URDU—DRAMA - CONCLUDED.,Urdu,,Drama,3,28,500,"The Civil and Military Organ Press, Lndhiana.",The Civil and Military Organ Press,Lndhiana,,Kali Nagan ke Gayan,True,"The songs of the play entitled ""Kali Nagan."" Compiled by Professer Narain Singh, Ahluwalia.",20,Royal Theatrical Company,Multan,1910-10-15,2 annas,1st,8°,litho.,,,,,Urdu,,The Civil and Military Organ Press,Lndhiana,Royal Theatrical Company,Multan,20,"[{""field"": ""pcity"", ""issue"": ""'Lndhiana' printed thus (Ludhiana)""}]"
1911Q1,221,28,URDU—FICTION.,Urdu,,Fiction,3,318,"1,000",Ditto,Hindustan Press,Lahore,,—— Hissa-i-Suwam ——,True,Part III.,40,,,1911-01,4 annas,1st,8°,litho.,,,,,Urdu,,Hindustan Steam Press,Lahore,,,40,"[{""field"": ""date"", ""issue"": ""printed 'Janary'""}, {""field"": ""format"", ""issue"": ""printed '8,° litho.'""}]"
1911Q1,221,28,URDU—FICTION.,Urdu,,Fiction,4,332,"1,000","Qaumi Press, Sialkot.",Qaumi Press,Sialkot,"Fasih, Mr.",Ashiq-i-Sadiq,True,"A small novel in which the hero, who is one of the best sculptors in Italy, destroys a statue, made by himself, of his beloved in order to save her from curious eyes. He ultimately gets the first prize for his statue and the hand of his lady love for having thus proved a true lover.",16,Author,Sialkot,1910-10-24,3 pies,1st,32°,litho.,,,,,Urdu,,Qaumi Press,Sialkot,Author,Sialkot,16,[]
1911Q1,221,28,URDU—FICTION.,Urdu,,Fiction,5,322,"1,000","Hindustan Press, Lahore.",Hindustan Press,Lahore,"Ghulam Muhammad, Mian.",Bigre Dil,True,A story intended to lay bare the evils of illicit love.,36,"Lala Lachhman Das, Ahuja, book-seller",Lahore,1911-01,10 annas,2nd,8°,litho.,,,,,Urdu,,Hindustan Steam Press,Lahore,"Lala Lachhman Das, Ahuja, book-seller",Lahore,36,[]
1911Q1,221,28,URDU—FICTION.,Urdu,,Fiction,6,309,"1,000","Hamidiya Press, Lahore.",Hamidiya Press,Lahore,"Jauhar, M. S , Mr.",'Aql mandon ke Latife,True,A collection of humorous anecdotes.,32,"B. Daya Singh, book-seller",Lahore,1911-01-07,3 annas,1st,8°,litho.,,,,,Urdu,,Hamidiya Steam Press,Lahore,"B. Daya Singh, book-seller",Lahore,32,[]
1911Q1,221,28,URDU—FICTION.,Urdu,,Fiction,7,310,"1,000",Ditto,Hamidiya Press,Lahore,"Muhammad Husain, Munshi.",Dozakh ki Malikah,True,"or the queen of hell. The story of the guilty love of a Nawab's wife and one of her slaves, who treacherously shot the Nawab. Ultimately the lady murdered the slave and committed suicide",46,"B. Daya Singh, Book-seller",Lahore,1911-01-10,Re. 1,1st,8°,litho.,,,,,Urdu,,Hamidiya Steam Press,Lahore,"B. Daya Singh, Book-seller",Lahore,46,[]
1911Q1,222,29,URDU—HISTORY.,Urdu,,History,1,20,500,"The Civil and Military Organ Press, Ludhiana.",The Civil and Military Organ Press,Ludhiana,"Bhagat Ram, Lala",Tank Wansh Prakash,True,"or a short account of the Tank Wansh race of Arya Hindus, who came through the north-west passes and conquered the Punjab.",32,Author,Jammu,1910-11-08,Free,1st,16°,litho.,,,,,Urdu,,The Civil and Military Organ Press,Ludhiana,Author,Jammu,32,[]
1911Q1,222,29,URDU—HISTORY.,Urdu,,History,2,19,1000,"Roze Bazar Steam Press, Amritsar.",Roze Bazar Steam Press,Amritsar,"Sayad Sulaiman, Maulvi",Musalman Auraton ki Bahaduri,True,or brief accounts of renowned Muhammadan women who proved to be patriots and warriors aud took prominent parts in politics in the early days of Islam.,36,Vakil Trading Company,Amritsar,1910-11-27,1 anna,1st,16°,litho.,,,,,Urdu,,Roze Bazar Steam Press,Amritsar,Vakil Trading Company,Amritsar,36,[]
1911Q1,222,29,URDU—HISTORY.,Urdu,,History,3,11,1000,Ditto,Roze Bazar Steam Press,Amritsar,,"Tarjama-i-High Roads of History, Pahli Kitab",True,"or an Urdu translation, by Miraj-ud-din Ahmad, of the book entitled the ""High Roads of History, Part I,"" published by Thomas Nelson & Co., London.",63,"Siraj-ud-din Pal and Brothers, book-sellers",Amritsar,1910-11-26,10 annas,1st,16°,litho.,Y,"Siraj-ud-din Pal and Brothers, Book-sellers, Amritsar; No. 1, dated the 4th January, 1911.",,,Urdu,,Roze Bazar Steam Press,Amritsar,"Siraj-ud-din Pal and Brothers, book-sellers",Amritsar,63,[]
1911Q1,222,29,URDU—FICTION—CONCLUDED.,Urdu,,Fiction,8,320,1000,"Hindustan Press, Lahore.",Hindustan Press,Lahore,"Muzaffar Husain, Hakim",Dudh ka Dudh Pani ka Pani,True,"The story of a greedy tyrannical Nawab who, in order to succeed to ancestral property, murdered his relatives, but was ultimately punished.",4 and 44,"Lachhman Das, Ahuja, book-seller",Lahore,1911-01,12 annas,1st,8°,litho.,,,,,Urdu,,Hindustan Steam Press,Lahore,"Lachhman Das, Ahuja, book-seller",Lahore,48,[]
1911Q1,222,29,URDU—FICTION—CONCLUDED.,Urdu,,Fiction,9,321,1000,Ditto,Hindustan Press,Lahore,"Muzaffar Husain, Muhammad, Hakim",Gariq-i-Rahmat,True,A tragic love story in which the heroine is married to another man and the hero commits suicide.,18,"Lala Lachhman Das, Ahuja, book-seller",Lahore,1911-01,6 annas,1st,8°,litho.,,,,,Urdu,,Hindustan Steam Press,Lahore,"Lala Lachhman Das, Ahuja, book-seller",Lahore,18,"[{""field"": ""price"", ""issue"": ""printed '6|annas', likely 6 annas""}]"
1911Q1,222,29,URDU—FICTION—CONCLUDED.,Urdu,,Fiction,10,323,1000,Ditto,Hindustan Press,Lahore,"Rahim Bakhsh, Munshi",Anjam-i-Ulfat,True,A domestic story in which the hero after great trials becomes a well-to-do man and marries the heroine.,48,"Lala Lachhman Das, Ahuja, book-seller",Lahore,1911-01,12 annas,1st,8°,litho.,,,,,Urdu,,Hindustan Steam Press,Lahore,"Lala Lachhman Das, Ahuja, book-seller",Lahore,48,[]
1911Q1,222,29,URDU—FICTION—CONCLUDED.,Urdu,,Fiction,11,74,900,"Makhzan Press, Delhi.",Makhzan Press,Delhi,"Sayad Ahmad, Munshi",Rahat Zamani ki Mazedar Kahani,True,or a domestic story-meant for girls].,168,Shaikh Muhammad Ikram,Delhi,1910-11-25,Re. 1,3rd,8°,litho.,,,,o,Urdu,,Makhzan Press,Delhi,Shaikh Muhammad Ikram,Delhi,168,[]
1911Q1,223,30,URDU—LANGUAGE.,Urdu,,Language,1,304,500,"Rajput Printing Works, Lahore.",Rajput Printing Works,Lahore,,Farhang Urdu ki Pahli Kitab,True,A glossary of difficult words occurring in Urdu ki Pahli Kitab or first reading book.,32,Jagat Singh,Lahore,1911-01,"Price, 2 annas.",1st,16°,litho.,Y,,,,Urdu,,Rajput Printing Works,Lahore,Jagat Singh,Lahore,32,[]
1911Q1,223,30,URDU—LAW.,Urdu,,Law,1,40,500,"Qawanin-i-Hind Press, Amritsar.",Qawanin-i-Hind Press,Amritsar,,Majmua Dharm Shastar wa Riwajat-i-Ahl-i-Hunud,True,The Hindu Law and Customs by J. D. Man. Translated by Munshi Nikodaria Mal.,"2, 4, 100, 954, 2",Author (translator),Amritsar,1910-11-21,"Price, Rs. 12.",1st,8°,litho.,,"Munshi Nikodaria Mal, Proprietor of the Qawanin-i-Hind Press, Amritsar; No. 4 dated the 4th January, 1911.",,,Urdu,,Qawanin-i-Hind Press,Amritsar,Author (translator),Amritsar,1062,"[{""field"": ""copyright"", ""issue"": ""degraded text, dates partly illegible""}]"
1911Q1,223,30,URDU (IN ROMAN CHARACTER)—LANGUAGE.,Urdu,Roman character,Language,2,286,500,"Rajeshwari Press, Ráwalpindi.",Rajeshwari Press,Ráwalpindi,"Muhammad Khan, Munshi",,False,Spy to Sepoy or a booklet of Roman Character intended for the use of sepoys of the Indian army.,38,Author,,1911-02-10,"Price, 6 annas.",1st,8°,litho.,Y,,"Published by the author who is a School Master, 84th Punjabis, Ráwalpindi Cantonment.",,Urdu,,Rajeshwari Press,Rawalpindi,Author,,38,[]
1911Q1,223,30,URDU—LAW.,Urdu,,Law,2,15,500,"Roze bazar Steam Press, Amritsar.",Roze bazar Steam Press,Amritsar,,"Musharrah Qanun Dakhl Raiyyatana Mulk Punjab, yani Act No. 16 San 1887",True,"Punjab Tenancy Act, or Act No. 16 of 1887. Annotated. Compiled by Shaikh Ghulam Muhammad.","2, 19, 244, 4, 20, 4",Author (compiler),Amritsar,1910-11-27,"Price, Rs. 2, annas 4.",8th,8°,litho.,,,"[Previous edition noticed in entry No. 2 at page 19 of the Catalogue for the quarter ending the 31st March, 1908.]",,Urdu,,Roze bazar Steam Press,Amritsar,Author (compiler),Amritsar,293,[]
